publication_id,member_id,title,authors,journal,year,url,raw_text,sort_order,extraction_source,strict_extracted,permissive_extracted,permissive_only
pub_a3cc3e0a7a,mem_7a99d9b527,,,,,http://www.ncbi.nlm.nih.gov/sites/entrez?db=pubmed&cmd=DetailsSearch&term=(Hollenberg+MD[Author]),View publications on PubMed,0,both,yes,yes,no
pub_54c67b6b49,mem_d46afd103a,,,,,https://scholar.google.com/citations?user=ZQmFgf0AAAAJ&hl=en,Google Scholar,0,both,yes,yes,no
pub_e99b4b0def,mem_529c362d70,,,,,https://scholar.google.com/citations?user=XUnmKGwAAAAJ,Google Scholar,0,both,yes,yes,no
pub_8e06c0f070,mem_9f51021d60,,,,,https://scholar.google.ca/citations?hl=en&user=if89VXEAAAAJ&view_op=list_works&sortby=pubdate,Google Scholar,0,both,yes,yes,no
pub_c4c95d143e,mem_9461efbef5,,,,2008,,Child welfare in the 21st century. Duncan Lindsey; Alan McLuckie; Aron Shlonsky. Oxford University Press. 16-Jan. (2008),0,both,yes,yes,no
pub_96c77b8850,mem_9461efbef5,,,,2013,,Narrative play therapy with families.. Melissa Rowbotham; Alan McLuckie. Jason Aronson Publishers. 125-158. (2013),1,both,yes,yes,no
pub_141d864017,mem_ab3c7cd459,,,,,https://scholar.google.ca/citations?user=f1BTB90AAAAJ&hl=en,Google Scholar,0,both,yes,yes,no
pub_ee7409038d,mem_29212b7883,,,,2019,,Hypoxia enhances the angiogenic properties of adipose stem cell-derived extracellular vesicles in culture.. Jolene Phelps; Neil Alexander Duncan; Alim Mitha; David Arthur Hart; Arindom Sen. (2019),0,both,yes,yes,no
pub_6d2b8cbc83,mem_29212b7883,,,,2018,,Adipose stem cell-derived extracellular vesicles promote angiogenesis in brain microvascular endothelial cells.. Jolene Phelps; Arindom Sen; Alim Mitha; Neil Alexander Duncan. (2018),1,both,yes,yes,no
pub_fd3c4359ef,mem_feaca2a8a0,,,,,https://scholar.google.ca/citations?hl=en&user=cyLK2lQAAAAJ,Google Scholar,0,both,yes,yes,no
pub_4c9a3f02ca,mem_db95c2910e,,,,2017,,Flexible electronic devices for biomedical applications. Mahdi Nikkhad; Mohsen Akbari; Pouya Mostafalu; Amir Sanati Nezhad. 341-366. (2017),0,both,yes,yes,no
pub_859f441444,mem_db95c2910e,,,,2019,,Droplet-based microfluidic platforms: an overview with focus on applications in biofuels. Davood Khojasteh; Amir Sanati Nezhad; Mohammad Manshadi; Ahmad Abdelrehim; Reza Kalami. Elsevier. 09-Jan. (2019),1,both,yes,yes,no
pub_48abf1aaf4,mem_db95c2910e,,,,2019,,Microreactors and their applications in bioenergy production. Reza Kamali; Mahdi Gholami; Amir Sanati Nezhad. Elsevier. 10-Jan. (2019),2,both,yes,yes,no
pub_1cae21c93c,mem_db95c2910e,,,,2018,,On-chip chromatography with nanomaterials. Farideh Haghighi; Zahra Talebpour; Amir Sanati Nezhad. Elsevier. 343-358. (2018),3,both,yes,yes,no
pub_14a53e77ac,mem_d4ec51610b,,,,,https://scholar.google.ca/citations?user=NH_yhQsAAAAJ&hl=en&oi=ao,Google Scholar,0,both,yes,yes,no
pub_20331cef1f,mem_d2301d7aac,,,,2018,,Hematolymphatic System. Jennifer Davies; Amy Louise Warren. CABI. (2018),0,both,yes,yes,no
pub_f7a0c1e297,mem_d2301d7aac,,,,2018,,Pathology terms. Amy Louise Warren. Elsevier. (2018),1,both,yes,yes,no
pub_a4b056b182,mem_d2301d7aac,,,,2019,,"Structure, function and disorders of the lymphoid organs.. Amy Louise Warren; Robin M Yates. Wiley-Blackwell. (2019)",2,both,yes,yes,no
pub_02e40686fb,mem_d2301d7aac,,,,2019,,Lymphopoiesis. Robin M Yates; Amy Louise Warren. Wiley-Blackwell. (2019),3,both,yes,yes,no
pub_8fcff93de3,mem_d2301d7aac,,,,2014,,Veterinary clinical laboratory immunology. Amy Louise Warren. University Press of Colorado. (2014),4,both,yes,yes,no
pub_4fe9ca5370,mem_945a42f165,,,,,https://scholar.google.com/scholar?hl=en&as_sdt=0%2C5&q=bulloch+ag&btnG=,Google Scholar,0,both,yes,yes,no
pub_9268878170,mem_41979986b6,,,,2023,https://doi.org/10.1016/j.cpr.2023.102336,"Cognitive-behavioral treatment for gambling harm: Umbrella review and meta-analysis . Pfund, R. A., Ginley, M. K., Kim, H. S., Boness, C. L., Horn, T. L., & Whelan, J. P. . Clinical Psychology Review. (2023)",0,both,yes,yes,no
pub_4cfd1e14c1,mem_41979986b6,,,,2023,https://doi.org/10.1037/adb0000966,"This time with feeling: Placing an in-play sports bet is a vehicle for emotion regulation . Vieira, J. L., Kim, H. S., Clark, L., Tabri, N., & Wohl, M. J. A. . Psychology of Addictive Behaviors. (2023)",1,both,yes,yes,no
pub_f2ef993bb3,mem_41979986b6,,,,2023,https://doi.org/10.1556/2006.2023.00046,"A mixed-method investigation of addiction substitution and concurrent recovery in gambling disorder: who substitutes and why? . Kim, H. S., Hodgins, D. C., & McGrath, D. S. . Journal of Behavioral Addictions. In press. (2023)",2,both,yes,yes,no
pub_c77507aaf5,mem_41979986b6,,,,2023,https://doi.org/10.1037/adb0000948,"Dispositional and contextual correlates of in-play sports betting and related harms: A two-week ecological monetary assessment study . Kim, H. S., Coelho, S. G., Vieira, J. L., & Keough, M. T. . Psychology of Addictive Behaviors. In press. (2023)",3,both,yes,yes,no
pub_ec68352324,mem_41979986b6,,,,2023,https://doi.org/10.1556/2006.2023.00030,"Who makes in-play bets? Investigating the demographics, psychological characteristics, and gambling-related harms of in-play sports bettors . Vieira, J. L., Coelho, S. G., Snaychuk, L. A., Parmar, P. K., Keough, M. T., & Kim, H. S.. Journal of Behavioral Addictions. In press. (2023)",4,both,yes,yes,no
pub_1e5ad10995,mem_41979986b6,,,,2023,https://doi.org/10.1007/s11469-022-01003-9,"Latent profile analyses and psychological characteristics of concurrent disorders in two large samples . Coelho, S., Keough, M. T., Hodgins, D. C., Parmar, P., Shead, N. W., & Kim, H. S. . International Journal of Mental Health and Addiction. In press. (2023)",5,both,yes,yes,no
pub_3bc3395331,mem_41979986b6,,,,2023,https://doi.org/10.1007/s11469-022-00900-3,"The perceived causes of problematic substance use, gambling, and other addictive behaviors from the perspective of people with lived experience . Coelho, S., Tabri, N., Kerman, N., Lefebvre, T., Longpre, S., Williams, R., & Kim, H. S. . International Journal of Mental Health and Addiction. In press. (2023)",6,both,yes,yes,no
pub_3d2ebd8fdb,mem_41979986b6,,,,2023,http://dx.doi.org/10.1037/adb0000883,"Review of third-wave therapies for substance use disorders in people of colour and collectivist cultures: Current evidence and future directions . Dela Cruz, G. A., Johnstone, S., Kim, H. S., & Castle, D. J.. Psychology of Addictive Behaviors. 681-694. (2023)",7,both,yes,yes,no
pub_f2871739cb,mem_41979986b6,,,,2023,https://doi.org/10.1556/2006.2023.00013,"A scoping review of the association between loot boxes, esports, skin betting, and token wagering with gambling and video gaming behaviors . Kim, H. S., Leslie, D., Stewart, S. H., King, D. L., Demetrovics, Z., Andrade, A. L. M., Choi, J-S., Tavares, H., Almedia, B., & Hodgins, D. C. . Journal of Behavioral Addictions. 309-351. (2023)",8,both,yes,yes,no
pub_8aa453fd84,mem_41979986b6,,,,2023,https://doi.org/10.1080/16066359.2022.2141717,"Loot box purchasing is associated with gambling and problem gambling when controlling for known psychological risk factors of gambling . Coelho, S., Keough, M. T., Hodgins, D. C., Shead, N. W., Parmar, P., & Kim, H. S. . Addiction Research & Theory. 260-269. (2023)",9,both,yes,yes,no
pub_ea2f295089,mem_41979986b6,,,,2023,https://doi.org/10.1016/j.psychres.2023.115459,"Psychometric properties of the Generalized Version of the Screener for Substance and Behavioral Addictions (SSBA-G): A comprehensive screening tool for substance-related and behavioural addictions . Konkolÿ-Thege, B., Moore, A., Szabó, G. S., Fitzgerald, M., Hodgins, D. C., & Kim, H. S. . Psychiatry Research. (2023)",10,both,yes,yes,no
pub_19c0827d19,mem_41979986b6,,,,2023,https://doi.org/10.1016/j.addbeh.2022.107473,"Emotion dysregulation mediates the relationship between adverse childhood experiences and problematic gaming . Kim, H. S., Vieira, J., Parmar, P. K., Hodgins, D. C., Shead, N. W., & Keough, M. T. . Addictive Behaviors. (2023)",11,both,yes,yes,no
pub_d1bf2ef3bf,mem_41979986b6,,,,2022,https://doi.org/10.1007/s10508-022-02412-6,"Co-occurring obsessive-compulsive disorder and compulsive sexual behavior: clinical features and psychiatric comorbidities . Snaychuk, L., Ferrao, Y., Fontenelle, L., Miguel, E. C., de Mathias, A., Scanavino, M., & Kim, H. S. Archives of Sexual Behavior. 4111-4123. (2022)",12,both,yes,yes,no
pub_4fac7a684f,mem_41979986b6,,,,2022,https://psycnet.apa.org/doi/10.1037/cap0000299,"Substance use and mental health disorders: Psychologists’ role in bridging the gap . Corace, K., Ares, I., Overington, L., & Kim, H. S.. Canadian Psychology. 405-412. (2022)",13,both,yes,yes,no
pub_c4df9ac5a5,mem_41979986b6,,,,2022,https://doi.org/10.1016/j.cpr.2021.102083,"A systematic review of addiction substitution: Clinical lore or empirically based? . Kim, H. S., Hodgins, D. C., Garcia, X., Ritchie, E. V., Musani, I., McGrath, D. S., & von Ranson, K. . Clinical Psychology Review. (2022)",14,both,yes,yes,no
pub_7b93f0a6fd,mem_41979986b6,,,,2020,https://doi.org/10.3390/jcm9020334,"Transdiagnostic or disorder specific? Indicators of substance and behavioral addictions nominated by people with lived experiences . Kim, H. S., Hodgins, D. C., Kim, B., & Wild, C. T. . Journal of Clinical Medicine. (2020)",15,both,yes,yes,no
pub_d1ec40d260,mem_41979986b6,,,,2020,https://doi.org/10.1016/j.addbeh.2020.106432,"Insecure attachment and addiction: Testing the mediating role of emotion dysregulation in four potentially addictive behaviors . Liese, B. S., Kim, H. S., & Hodgins, D. C. . Addictive Behaviors. (2020)",16,both,yes,yes,no
pub_823558ea2e,mem_41979986b6,,,,2020,https://doi.org/10.1016/j.psychres.2020.112763,"Gambling disorder and comorbid behavioral addictions: Demographic, clinical, and personality correlates . Tang, K, Kim, H. S., Hodgins, D. C., McGrath D. S., & Tavares, H. . Psychiatry Research. (2020)",17,both,yes,yes,no
pub_f7ff3dac22,mem_41979986b6,,,,2018,https://doi.org/10.3389/fpsyt.2018.00406,"Component model of addiction treatment: A pragmatic treatment model of behavioral and substance addictions . Kim, H. S. & Hodgins, D. C. . Frontiers in Psychiatry. (2018)",18,both,yes,yes,no
pub_4509fc7d7f,mem_41979986b6,,,,,https://www.researchgate.net/profile/Hyoun-S-andrew-Kim?ev=hdr_xprf&_tp=eyJjb250ZXh0Ijp7InBhZ2UiOiJfZGlyZWN0In19,Research Gate,19,both,yes,yes,no
pub_28b642e960,mem_41979986b6,,,,,https://scholar.google.com/citations?user=FYtWeAcAAAAJ&hl=en&oi=sra,Google Scholar,20,both,yes,yes,no
pub_5832246077,mem_3e0ef14a60,,,,2023,https://doi.org/10.1007/s10896-023-00566-y,Voices of Experience: Development of the Flourishing Practice Model of Capabilities of Intimate Partner Violence Specialists . (2023),0,both,yes,yes,no
pub_07958c7855,mem_3e0ef14a60,,,,2023,https://doi.org/10.1080/10437797.2023.219359,Developing Virtual Gaming Simulations to Promote Interdisciplinary Learning in Addressing Intimate Partner and Gender-Based Violence. . (2023),1,both,yes,yes,no
pub_5bb6c228e7,mem_3e0ef14a60,,,,2023,https://doi.org/10.1007/s10896-023-00558-y,Integrating the Voices of Youth with Lived Experience as Coresearchers to Improve Research and Practice Approaches to Childhood Experiences of Intimate Partner Violence . (2023),2,both,yes,yes,no
pub_2ec60dea8e,mem_3e0ef14a60,,,,2024,https://ijcar-rirea.ca/index.php/ijcar-rirea/authorDashboard/submission/339,"Narrative shelter for young people with childhood experiences of intimate partner violence: a concept for creating opportunities for storytelling, storylistening and resilience. International Journal of Child & Adolescent Resilience . (2024)",3,both,yes,yes,no
pub_bcdf480118,mem_3e0ef14a60,,,,2024,https://www.tandfonline.com/doi/full/10.1080/0886571X.2024.2405115,“A footnote in the file”: are we doing enough to attend to children’s experiences of intimate partner violence in out-of-home care settings? . (2024),4,both,yes,yes,no
pub_54119655f1,mem_3e0ef14a60,,,,2022,https://www.tandfonline.com/doi/full/10.1080/10437797.2022.2039819,Using virtual simulations to train social workers: The development of new pedagogical practice in an increasingly digital world. . (2022),5,both,yes,yes,no
pub_764063f555,mem_3e0ef14a60,,,,2022,https://www.tandfonline.com/doi/full/10.1080/10926771.2022.2052389,"Safe, not soft: Trauma- and violence-informed practice with perpetrators as a means of increasing safety. . (2022)",6,both,yes,yes,no
pub_c88cec513b,mem_3e0ef14a60,,,,2021,https://link.springer.com/article/10.1007/s42448-021-00094-6,Mothers in mind: Exploring the efficacy of a dyadic group parenting intervention for women experiencing intimate partner violence and their young children. . (2021),7,both,yes,yes,no
pub_3b0e42d737,mem_3e0ef14a60,,,,2018,,"The impact of exposure to IPV on children and youth: Considering strategies for cultivating resilience. W. DeKeseredy; Ramona Alaggia; Angelique Jenney; C. Rennison; K., A.. London, Taylor and Francis Ltd.. (2018)",8,both,yes,yes,no
pub_9ad5856764,mem_3e0ef14a60,,,,2019,,“More than just Ghosts in the Nursery: Understanding How the Presence of Violence and Trauma in the Lives of Infants and Young Children Impact on Parenting and Child Development.. Angelique Jenney; Chaya Kulkarni. Wilfrid Laurier Press. (2019),9,both,yes,yes,no
pub_b540b86fc9,mem_3e0ef14a60,,,,2012,,"Children’s exposure to domestic violence: Integrating policy, research and practice to address children’s mental health.. R. Alaggia; Ramona Alaggia; Angelique Jenney; C. Vine. Wilfrid Laurier Press. 303-336. (2012)",10,both,yes,yes,no
pub_81ef76bda6,mem_3e0ef14a60,,,,2019,,Keeping the Child in Mind when Thinking about Violence in Families. Sarah Jones; Angelique Jenney; Wendy Bunston. Jessica Kingsley Publishers. (2019),11,both,yes,yes,no
pub_53dad9e5e3,mem_3e0ef14a60,,,,2019,,The Role of Maternalism in Shaping the focus on Mothering in Child Protection Practice with Abused Women and Children. Angelique Jenney. (2019),12,both,yes,yes,no
pub_140afdb4df,mem_3e0ef14a60,,,,2019,,Safe and Understood: Collaborating to Provide Domestic Violence Parenting Interventions within Child Protection Services. Barbara Fallon; Angelique Jenney; Kathleen Kufeldt; Katreena Scott; Barbara McKenzie. Wilfrid Laurier University Press. (2019),13,both,yes,yes,no
pub_c1e3ce4360,mem_3e0ef14a60,,,,2006,,Children’s exposure to domestic violence.. Nico Trocme; Cathy Vine; Jasmine Hayes; Angelique Jenney; Ramona Alaggia. Wilfrid Laurier University Press. (2006),14,both,yes,yes,no
pub_d9f895ef65,mem_3e0ef14a60,,,,,https://scholar.google.ca/citations?user=MMDMTpMAAAAJ&hl=en,Google Scholar,15,both,yes,yes,no
pub_365b810908,mem_9e9c87242a,,,,,https://scholar.google.ca/citations?user=0n70JkUAAAAJ&hl=en,Google Scholar,0,both,yes,yes,no
pub_67c029367c,mem_1ae867ffe5,,,,2022,,"Art-Making Promotes Mental Health: A Solution for Schools That Time Forgot.. Martin, B.H. & Colp, S.M.. Canadian Journal of Education. Forthcoming 2022. (2021)",0,both,yes,yes,no
pub_0641389a5d,mem_1ae867ffe5,,,,2021,,"Effects of Teacher Mindset on Developing Growth Mindset in Girls and Boys. Mesler, R., Martin, B.H., and Corbin, C. . Journal of Applied Developmental Psychology. 76, 101299. (2021)",1,both,yes,yes,no
pub_3a4da5c247,mem_1ae867ffe5,,,,2020,,"Arts integration in Northland, New Zealand: A case of socially empowered learning. Buck, R., Snook, B., & Martin, B.H.. Journal of Artistic and Creative Education. (2020)",2,both,yes,yes,no
pub_4c2cb758ad,mem_1ae867ffe5,,,,2020,,"Techno-Bio-Poetica: Reweaving the Posted Poetics of Academic Travel. Martin, B.H. & Sinner, A. . Vitae Scholastica: The Journal of Educational Biography. (2020)",3,both,yes,yes,no
pub_7b800fe52e,mem_1ae867ffe5,,,,2019,,"The Artistry of Innovation: Increasing Artistic Quotient for Innovative Efficacy. Martin, B.H.. Canadian Journal of Education. 42(2), 576-604. . (2019)",4,both,yes,yes,no
pub_bc569b4a9f,mem_1ae867ffe5,,,,2018,,"Mixed-Methods Triage: Coalescing Holistic Perspectives for a More Diverse and Inclusive Academy. Martin, B.H.. The Electronic Journal of Business Research Methods. 16(2), pp. 80-85.. (2018)",5,both,yes,yes,no
pub_21f1295d30,mem_1ae867ffe5,,,,2018,,"Creating the Dance and Dancing Creatively: Exploring the Liminal Space of Choreography for Emergence. Martin, B.H., Snook, B., & Buck, R.. Journal of the Canadian Association for Curriculum Studies. 16(1), 162-174. (2018)",6,both,yes,yes,no
pub_920d0e829a,mem_1ae867ffe5,,,,2018,,"Social Empowerment: The Evolution of a Model and Scale Design that Measures Arts Integration, Social Enterprise, and other Socially Empowered Learning. Martin, B.H.. International Journal of Arts Education. 13 (1), 1-17. (2018)",7,both,yes,yes,no
pub_ef92e84c42,mem_1ae867ffe5,,,,2018,,"Socially Empowered Learning in the Classroom: Effects of Arts Integration and Social Enterprise in Schools. Martin, B.H. & Calvert, A.C.. Journal of Teaching and Learning. 11(2), 27-42.. (2018)",8,both,yes,yes,no
pub_ed124861f6,mem_1ae867ffe5,,,,2017,,"Unsticking the Status Quo: Strategic Framing Effects on Managerial Mindset, Cognitive Bias, and Systematic Resistance to Change. Martin, B.H.. Management Research Review. 40(3), 122-141. . (2017)",9,both,yes,yes,no
pub_7e0b4a2c6a,mem_1ae867ffe5,,,,2017,,"Teaching the Arts as a Second Language: A School-wide Policy Approach to Arts Integration. Martin, B.H.. Arts Education Policy Review. 118(2), 116-122. (2017)",10,both,yes,yes,no
pub_400fe77303,mem_1ae867ffe5,,,,2012,,"Is Telework Effective for Organizations? Meta-Analysis of the Perceptions on Telework and Organizational Outcomes. Martin, B.H. & MacDonnell, R. . Management Research Review. Vol 25(7), pp. 602-616. (2012)",11,both,yes,yes,no
pub_d51344ccd0,mem_1ae867ffe5,,,,2019,,Promoting Arts Co-Curricular Enhancement (ACE): How Cross-Faculty Collaboration Transforms the Undergraduate Experience. Dawn Johnston; Brittany Harker Martin; Michael Holden. Arts in Society - Common Ground. (2019),12,both,yes,yes,no
pub_dabdb33ae7,mem_1ae867ffe5,,,,2019,,The Artistry of Innovation: Increasing Teacher's Innovative Capacity and Innovative Efficacy. Brittany Harker Martin. Canadian Society for Studies in Education. (2019),13,both,yes,yes,no
pub_c557a447b6,mem_1ae867ffe5,,,,2019,,Brain Smoothies in Schools: Building Mental Health Capacity Through a Daily Dose of Art. Brittany Harker Martin. American Educational Research Association. (2019),14,both,yes,yes,no
pub_4a30e2cf1b,mem_1ae867ffe5,,,,2019,,The Power to Engage: Effects of Co-Curricular Service-Learning in Teacher Education. Brittany Harker Martin. European Conference on Educational Research. (2019),15,both,yes,yes,no
pub_84c9bfda15,mem_1ae867ffe5,,,,2018,,The Choreography of Learning and Artistry of Instructional Design When Teaching through Dance. Brittany Harker Martin. Arts in Society - Common Ground. (2018),16,both,yes,yes,no
pub_1611ff9b15,mem_1ae867ffe5,,,,2018,,Research That Makes a Difference: Engaging the Community through the Newcomer Research Network. Brittany Harker Martin. (2018),17,both,yes,yes,no
pub_61c6758d89,mem_1ae867ffe5,,,,2018,,Dismantling the Expert: Challenges and Tensions in Facilitating/Directing Performative Research Ensembles. Brittany Harker Martin. American Educational Research Association. (2018),18,both,yes,yes,no
pub_11c953d313,mem_1ae867ffe5,,,,2018,,Socially Empowered Learning Research Around the World: State of the Knowledge and Lessons from the Field. Brittany Harker Martin. World Educational Research Association. (2018),19,both,yes,yes,no
pub_8a234384a8,mem_1ae867ffe5,,,,2018,,"Developing Engaged Thinkers, Ethical Citizens and Entrepreneurial Spirit: Applying the Socially Empowered Learning Framework in Community. Brittany Harker Martin; Greg Burbidge; Emiko Muraki. Arts in Society - Common Ground. (2018)",20,both,yes,yes,no
pub_c4b6a3af04,mem_1ae867ffe5,,,,2018,,Enabling Artistic Teachers: Effects of Professional Learning for Artistry of Instructional Design. Brittany Harker Martin. European Conference on Educational Research. (2018),21,both,yes,yes,no
pub_a08c972429,mem_1ae867ffe5,,,,2017,,Developing the Artistry of Instructional Design: Capacity Building to Increase Artistic Teacher Efficacy. Brittany Harker Martin. European Conference on Educational Research. (2017),22,both,yes,yes,no
pub_f51a6cf32e,mem_1ae867ffe5,,,,2017,,Non-traditional Professor's Playbook: How To Successfully Follow a Non-traditional Track OR Work With Professors That Do. Ashley Lesko; Brittany Harker Martin. Organizational Behavior Teaching Conference. (2017),23,both,yes,yes,no
pub_c03540f73c,mem_1ae867ffe5,,,,2017,,"Experiences of Dance Integration: An International, Duo-Ethnographic Jam. Brittany Harker Martin; Barbara Snook. World Dance Alliance. (2017)",24,both,yes,yes,no
pub_3ebd431d38,mem_1ae867ffe5,,,,2017,,Healing Through The Arts: Arts-based Practices for Healing and Empowerment in Post-Trauma Contexts. Brittany Harker Martin; Rita Egizzi. World Alliance for Arts Education. (2017),25,both,yes,yes,no
pub_70b3ad4c81,mem_7a1797f182,,,,,https://scholar.google.ca/citations?user=-y-yqgoAAAAJ&hl=en,Google Scholar,0,both,yes,yes,no
pub_c5bafd632a,mem_df3ac5151d,,,,,https://scholar.google.com/citations?hl=en&user=lELiW7YAAAAJ&view_op=list_works,Google Scholar,0,both,yes,yes,no
pub_fcbb45c355,mem_de66826bad,,,,2016,,Adults with cerebral palsy: Physical and mental health issues and health service use patterns. C Hatton; E Emersson; Y Lunsky; K Dobranowski; D Fehlings; C McGarry; R S Balogh; J K Lake; M Bayley; Carly A McMorris. Elsevier. (2016),0,both,yes,yes,no
pub_3265b0357a,mem_de66826bad,,,,2011,,Program Components. J Schroeder; M Ames; Carly McMorris. (2011),1,both,yes,yes,no
pub_6ac2c70946,mem_de66826bad,,,,2011,,Starting Up. Carly McMorris; J Schroeder. (2011),2,both,yes,yes,no
pub_359bdac09a,mem_de66826bad,,,,2011,,Group Events. Carly McMorris; M Ames. (2011),3,both,yes,yes,no
pub_f7826cb0fd,mem_de66826bad,,,,2016,,Specialized and mainstream psychiatric or mental health services for adults with Intellectual Disabilities. Lunsky; Carly McMorris; N Bouras; C Hemmings; J Lake. Cambridge University Press. (2016),4,both,yes,yes,no
pub_193a592f63,mem_de66826bad,,,,2011,,Concerns in early development that may be predictive of specific Pervasive Developmental Disorder diagnoses. J. H. Schroeder; J. J. Holden; C. A. McMorris; J. M. Bebko. (2011),5,both,yes,yes,no
pub_93eb335c4f,mem_de66826bad,,,,2016,,Predictors of exogenous attention abilities in children and youth with and without Autism Spectrum Disorder. J M Bebko; Carly A McMorris. (2016),6,both,yes,yes,no
pub_a2c9a79332,mem_de66826bad,,,,2016,,The impact of March break and summer program funding on the stress of caregivers of children withautism.. J M Bebko; J H Abrams; O Jon; L Verbeek; B Ncube; M Spoelstra; G Konstosic; Carly A McMorris. (2016),7,both,yes,yes,no
pub_3d29d4cc77,mem_de66826bad,,,,2016,,Examining transition and vocational pathways in ASD: Perspectives of individuals with ASD andparents.. L Zwaigenbaum; M Clarke; R Zulla; W Mitchell; T Jubenville; Carly A McMorris; David Nicholas; S Hodgetts; Katelyn Lowe. (2016),8,both,yes,yes,no
pub_2f043c6ae2,mem_de66826bad,,,,2014,,Pharmacotherapy and medication appropriateness in children and adolescents with Autism Spectrum Disorder (ASD). J. Hudson; B. L. Ncube; C. A. McMorris; X. Liu; J. Lake; J Bebkko. (2014),9,both,yes,yes,no
pub_58f411e3ba,mem_de66826bad,,,,2010,,The relationship between social competence and bullying victimization experiences in children and adolescents with ASD and typical development. J Weiss; J Bebko; Carly McMorris; S Dhala; D Pepler; J Schroeder; M Cappadocia. (2010),10,both,yes,yes,no
pub_569c0edc46,mem_de66826bad,,,,2013,,Crisis in adults with Autism Spectrum Disorders.. J K Lake; Y Lunsky; Carly A McMorris. (2013),11,both,yes,yes,no
pub_c1c0850159,mem_de66826bad,,,,2013,,Evaluating need and reduction in parental stress with Autism Ontario’s March break and summer program funding. O* Jon; J Schroeder; J Bebko; Carly McMorris; Kontosic G; M Spolestra. (2013),12,both,yes,yes,no
pub_6b1be10b6a,mem_de66826bad,,,,2013,,The diagnostic process in children and adolescents with a Pervasive Developmental Disorder:Change in diagnoses over time. J H Schroeder; Carly A McMorris; J M Bebko. (2013),13,both,yes,yes,no
pub_6426f0443c,mem_de66826bad,,,,2013,,Level of parents satisfaction with the Autism Spectrum Disorder diagnostic process:Implications for early diagnosis and intervention. J H Schroeder; J M Bebko; Cox EA.*; Carly A McMorris. (2013),14,both,yes,yes,no
pub_3a5a955485,mem_de66826bad,,,,2012,,Predictors of inpatient admission for individuals with and without autism spectrum disorders. Y Lunsky; A Palucka; Carly McMorris; P Raina. (2012),15,both,yes,yes,no
pub_1f4d9013b4,mem_de66826bad,,,,2012,,Intermodal perception and attention shifting in children with Autism Spectrum Disorders.. J Bebko; Carly McMorris. (2012),16,both,yes,yes,no
pub_a0c1bee2bc,mem_de66826bad,,,,2011,,Predictors of inpatient admission for individuals with autism spectrum disorders.. Y Lunsky; Carly A McMorris; A Palucka; P Raina. (2011),17,both,yes,yes,no
pub_dc920a196c,mem_de66826bad,,,,2010,,Efficacy of crisis services: Perspectives of families and staff. J Weiss; Carly A McMorris; G Cappalletti; Y Lunsky. (2010),18,both,yes,yes,no
pub_b9a654fa5d,mem_de66826bad,,,,2010,,Iconic memory in children with Autism Spectrum Disorder. J. M. Bebko; C. A. McMorris; L. Hancock. (2010),19,both,yes,yes,no
pub_db64e103c4,mem_de66826bad,,,,2010,,An analysis of response times on a short-term memory task in children with ASD. F. Mak; C. A. McMorris; S. Brown; J. M. Bebko. (2010),20,both,yes,yes,no
pub_86037b32ae,mem_de66826bad,,,,2010,,Evaluation of the York University Asperger Mentorship Program. Carly McMorris; the York; J Bebko; L Hancock; M Ames. (2010),21,both,yes,yes,no
