publication_id,member_id,title,authors,journal,year,url,raw_text,sort_order,extraction_source,strict_extracted,permissive_extracted,permissive_only
pub_cfca8c5730,mem_707257fb34,,,,2023,,"Attitudes towards LGBTQ+ Inclusion in Canadian Figure Skating. Schnell, A., Godley, J. and Bridel, W.. The Open Sports Sciences Journal. (2023)",6,both,yes,yes,no
pub_46a3b09872,mem_707257fb34,,,,2023,,"The contribution of modifiable risk factors to socioeconomic inequities in cardiovascular disease morbidity and mortality: A nationally representative population-based cohort study. Nejatinamini, S., Campbell, D., Godley, J., Minaker, L., Sajobi, T.T., McCormack, G., and Olstad, D.. Preventive Medicine. (2023)",7,both,yes,yes,no
pub_f2ee65dd1e,mem_707257fb34,,,,2023,,"Impact of a farmers’ market healthy food subsidy on the diet quality of adults with low incomes in British Columbia, Canada: a pragmatic randomized controlled trial.. Aktary, M.L., Dunn, S., Sajobi, T., O’Hara, H., Leblanc, P., McCormack, G.R., Caron-Roy, S., Ball, K., Lee, Y.Y., Nejatinamini, S., Reimer, R.A., Pan, B., Minaker, L.M., Raine, K.D., Godley, J., Downs, S., Nykiforuk, C.I.J., Olstad, D.L.. American Journal of Clinical Nutrition. (2023)",8,both,yes,yes,no
pub_9dca5f36ce,mem_707257fb34,,,,2023,,"Variation in Testing for and Incidence of Celiac Autoimmunity in Canada: A Population-Based Study. King, J.A., Bakal, J.A., Li, B., Whitten, T.A., Gidrewicz, D., Turner, J.M., van Zanten, S.V., Huynh, H.Q., Heitman, S.J., Shaheen, A.A., Quan, H., Godley, J., Underwood, F.E., Hracs, L., Bergman, D., Ludvigsson, J.F., Lebwohl, B., Benchimol, E.I., Williamson, T. and Kaplan, G.G.. Gastroenterolog. (2023)",9,both,yes,yes,no
pub_c6469ee781,mem_707257fb34,,,,2022,,"Income, Education, and Hospitalization in Canada: Results from linked Census and administrative data. Godley, J. and Tang, K.L.. Discover Social Science and Health. (2022)",10,both,yes,yes,no
pub_e67fcbe450,mem_707257fb34,,,,2022,,"Exploring the Relationship Between Eating Disorders and Fitspiration Influencers.. Mehra, M. and Godley, J.. Journal of Undergraduate Research in Alberta. (2022)",11,both,yes,yes,no
pub_2a34102848,mem_707257fb34,,,,2021,,"Survey Research on Health Inequalities: Exploring the Availability of Indicators of Multiple Forms of Capital in Canadian Datasets.. Godley, J., Fundytus, F., Stones, C., Peller, P., and McLaren, L.. International Journal of Public Health. (2021)",12,both,yes,yes,no
pub_0d44cf1a15,mem_707257fb34,,,,2021,,"Quantifying the contribution of modifiable risk factors to socio-economic inequities in cancer morbidity and mortality: a nationally representative population-based cohort study.. Nejatinamini, S., Godley, J., Minaker, L.M., Sajobi, T.T., McCormack, G.R., Cooke, M.J., Nykiforuk, C.I.J., de Koning, L., and Olstad, D.L.. International Journal of Epidemiology. (2021)",13,both,yes,yes,no
pub_4ca783f6a5,mem_707257fb34,,,,2022,,"Embedding Ethics in Institutional SoTL Practices: The Power of Collaboration. In: Fedoruk, L.M. (eds) Ethics and the Scholarship of Teaching and Lear. Fedoruk, L.M., Godley, J., Mueller, R.A., Mikita, K., McDougall, L.. Ethics and Integrity in Educational Contexts. (2022)",14,both,yes,yes,no
pub_e1826d86ed,mem_707257fb34,,,,2001,,"Monday, October 22, 2001-Board 2 Abstract\# 22064 Body image and body management in adolescence: Gender, race, and self-perception. Jenny Godley. (2001)",15,both,yes,yes,no
pub_0202c05ab4,mem_37dd23d078,,,,,https://scholar.google.ca/citations?user=2bgLYxkAAAAJ&hl=en,Google Scholar,0,both,yes,yes,no
pub_913cc887ce,mem_22a4e04503,,,,,https://painslab.ca/publications/,Lab Website,0,both,yes,yes,no
pub_ee2cef4b3e,mem_7d3968111f,,,,,https://scholar.google.com/citations?user=DadyMJcAAAAJ&hl=en,Google Scholar,0,both,yes,yes,no
pub_4efb6ceb1b,mem_36447b4ebf,,,,,https://scholar.google.ca/citations?user=aTS197oAAAAJ&hl=en,Google Scholar,0,both,yes,yes,no
pub_2fea45a4d9,mem_36447b4ebf,,,,,https://www.researchgate.net/profile/Joern-Davidsen,Research Gate,1,both,yes,yes,no
pub_a400f571c0,mem_36447b4ebf,,,,,https://www.ucalgary.ca/davidsen/publications,Personal Webpage,2,both,yes,yes,no
pub_c3fce4bb02,mem_bd40fc0757,,,,,https://scholar.google.ca/citations?user=-okTHvcAAAAJ&hl=en&oi=ao,Google Scholar,0,both,yes,yes,no
pub_4d81889929,mem_f7f8d26dcb,,,,,https://scholar.google.ca/citations?user=RZuLyCUAAAAJ&hl=en,Google Scholar,0,both,yes,yes,no
pub_1e5f4594f5,mem_74bc2844fc,,,,,https://scholar.google.com/citations?user=fgxJMVEAAAAJ&hl=en&oi=sra,Google Scholar,0,both,yes,yes,no
pub_a02e9ffbf8,mem_32d283f76b,,,,,https://scholar.google.ca/citations?user=eggermontjj,Google Scholar,0,both,yes,yes,no
pub_2df85fe47e,mem_6b37eba80f,,,,,https://scholar.google.com/citations?hl=en&user=JRiQoFgAAAAJ&view_op=list_works&sortby=pubdate,Google Scholar,0,both,yes,yes,no
pub_d7c5bc55bb,mem_37b64942a2,,,,2021,,"Role of N-methyl-d-aspartate receptor subunits GluN2A and GluN2B in auditory thalamocortical long-term potentiation in adult mice. Michael Zeeman, Xiuping Liu, Oliver Zhang, Jun Yan. Neurosci Lett. (2021)",0,both,yes,yes,no
pub_d65d46f738,mem_37b64942a2,,,,2020,,"Three dimensional rendering of auditory neuronal responses: A novel illustration of receptive field across frequency, intensity & time domains. Farhad Qureshi, Jun Yan. J Neurosci Methods. (2020)",1,both,yes,yes,no
pub_4e8a04f3d9,mem_37b64942a2,,,,2020,,"Cortical Stimulation Induces Excitatory Postsynaptic Potentials of Inferior Colliculus Neurons in a Frequency-Specific Manner. Jiyao Qi, Zizhen Zhang, Na He, Xiuping Liu, Caseng Zhang, Jun Yan. Front Neural Circuits. (2020)",2,both,yes,yes,no
pub_c34148c6fe,mem_37b64942a2,,,,2020,,"Thalamic gating contributes to forward suppression in the auditory cortex. Colin Xiong, Xiuping Liu, Lingzhi Kong, Jun Yan. PLoS One. (2020)",3,both,yes,yes,no
pub_920b8bbec8,mem_37b64942a2,,,,2019,,"Corticofugal Augmentation of the Auditory Brainstem Response With Respect to Cortical Preference. Xiuping Liu, Oliver Zhang, Amber Chen, Kaili Hu, Günter Ehret, Jun Yan. Front Syst Neurosci. (2019)",4,both,yes,yes,no
pub_6c5c4c8df8,mem_37b64942a2,,,,2019,,"The onset and post-onset auditory responses of cochlear nucleus neurons are modulated differently by cortical activation. Xiuping Liu, Oliver Zhang, Jiyao Qi, Amber Chen, Kaili Hu, Jun Yan. Hear Res. (2019)",5,both,yes,yes,no
pub_1162bdbc7b,mem_37b64942a2,,,,,https://scholar.google.ca/citations?user=yHGsyOAAAAAJ&hl=en,Google Scholar,6,both,yes,yes,no
pub_4778ab4f2f,mem_1a2035eb16,Publications Pub Med ORCID,,,,,Publications Pub Med ORCID,0,permissive_only,no,yes,yes
pub_be02f93ff0,mem_3faa6c8292,,,,,https://scholar.google.ca/citations?hl=en&user=uLNAcCQAAAAJ,Google Scholar,0,both,yes,yes,no
pub_d75711c7bc,mem_c513c5ffa8,,,,2019,,"The Relationship Between Saliva Cortisol Measures, Symptom Burden, Length of Recovery and Concussion History Following Pediatric Sport- Related Concussion.. Parker* L La; Katherine Wynne-Edwards; Kathryn J Schneider; Chantel T Debert; Black AM*; Carolyn A Emery; Gregory Alan A Kline. e49-e69. (2019)",0,both,yes,yes,no
pub_9fac314de9,mem_c513c5ffa8,,,,2017,,Measuring the Benefits of Entrepreneurship Education. Yuriy Zinchenko; Jason M.K. Donev; Shalina S Ousman; John Andrew Cobb; Nigel Antony Caulkett; Kimberley Anne Grant; Kaela Jubas; Xin Wang; Barbara Anna Brown; Katherine Elizabeth Wynne-Edwards; Matthew Greenberg; Joshua David Goldstein; Meghan Jennifer Elliott; David A. Keegan; Jong Min Rho; Jessica M Theodor; Craig Warryn Clifford Ginn; Janet Rankin; Sean Michael Rogers; Thomas Stelfox; Majid Pahlevani; Tatyana Plaksina; Marc Kerba; Karen Anne Liljebjelke; Benjamin D Stephenson; Hung-Ling (Steve) Liang; Jingjing Wu; Michael Ullyot; David Michael Scott; David Gordon Dick; Elena Di Martino; Jonathan Howlett; Jack M Mintz; Elizabeth Mary Rohlman; Stephen Winters; David Steven Sinasac; Jean-Francois Richer; Andrew Estefan; Marcello Tonelli; Irene Wai Yan Ma; Hanan Adel Ragi Armanious; Ivan Denislavov Detchev; Robert Bruce McCorkell; Kimberley A Clarke; Karsina Orsel; Wenyuan Liao; Deanne Sowter; Daniel Hirsh Shugar; Janet M de Groot; Marcus Samuel; Getachew Assefa; Judit Emmy Geraldine Smits; Susan Mathew Samuel; Per Kent Pedersen; Rachel Helen Ellaway; Aleksandra Mineyko; Sylvia L. Checkley; Jessica Corinne Allen Shaw; Amy Louise Warren; Dianne P. Mosher; Frank MacMaster; Tanya Mudry; Amal Madibbo; David Howe Wood; Peter Peller; Deborah Marie Kurrasch; Ayse Deniz Sezer; Lawrence Wawrzyniec Korngut; Simon Trudel; Fiona Costello; Tarek A. Bismar; Pietro Ravani; Karlee Fellner; G. Bruce Pike; Faye Halpern; Cynthia Seow; Chantal Julianne McMillan; Heinrike Schmeling; Stephanie Megan Kirkpatrick; Joern Alfred Davidsen; Ashley Elizabeth Whitehead; Mohamed Faizal Abdul Careem; Pete Robinson; Herman W Barkema; Alex E Bierman; Jean-Rene Leblanc; Michel Levy; Kunio Tsuyuhara; Nader Mahinpey; Hans Dieter Osthoff; Andrew Brent Davis; Vincent Ashley Gabriel; Susan Powelson; David Layzell; Melissa Ann Boyce; Tamara Milka Pringsheim; Mea Wang; Hadi Hemmati; Philipp Woelfel; Branko R Kolarevic; Fariba Aghajafari; Adrienne Lee; Anne Marie Roggensack; Yves Pieter Starreveld; Maria Stoletova; April A. Viczko; Rachael Crowder; Jennifer Cuthbertson; Lauren Rachelle Robinson; Scott Andrew Robison; Kristopher A.H. Innanen; Simon Hirota; Susan Franceschet; Adam Pidlisecky; Alexandru Badescu; Uttandaraman Sundararaj; Rajeev Kumar Sasidharan Nair; Stefania Forlini; Philip Wai Leung Fong; Josephine Ho; Eric E Smith; Mary E Brindle; Jeremy Fantl; Sofia B Ahmed; Maureen Therese Duffy; James Boyd Apple; Ina Dobrinski; Roger John Thompson; Richard Edward Allan Walker; Fanny Thérčse Macé; Jayna Marie Holroyd-Leduc; Jeong Woo Kim; Chantelle Bernadette Barnard; Campbell Paul Rolian; Francesca Cadel; Renaud Leguillette; Komlan Gbanou; Soren R. Boysen; Vera M Parlac; Edmond Anthony Pajor; W. Michael Scott; Twyla A. Ens; Frances Ugo Kalu; Robert Douglas Wilson; Melanie J Kloetzel; Angelo Mikrogianakis; John MacGregor Steele; Christopher Terrance Naugler; Andrew Szeto; Peter Stys; Marius Georgescu; Sachin R. Pendharkar; Fiona Simone Maria Schulte; Antonio Franceschet; Kerry Alison McBrien; Joshua Michael Taron; John Patrick Kastelic; Alfred Karmen Yeung; Naor Cohen; Susan Catherine Cork; Melanie Elizabeth Noel; David Clement Hall; Saulesh B Yessenova; Maureen Sharon Hiebert; Priyadarshini Kharat; Gerald Giesbrecht; Janki Shankar; Sally Ann St. George; Lisa Marie Gieg; Antonia Schirmer Stang; Jan-Willem Henning; Roman Krawetz; Farnaz Sadeghpour; Julie Lefebvre; Tia Halliday; Chui-Ling Tam; Mehdi Mourali; Robin M Yates; Oleksiy Osiyevskyy; Quazi Khalid Hassan; Belinda Josiane M Heyne; Eddy S. Lang; Sharaz Khan; Sytle Medicia Antao; David William Nordstokke; Prasanth Chelikani; Ryan Douglas Henry; Michael Peter Ilg; Maria Jose Santana; J. Ari Pandes; Martin Jasso; Ilyan Ferrer; Ranjani Somayaji; Gavin Robert McCormack; Faisal Masood Khan; Kevin McQuillan; Sergei Noskov; Giuseppe Iaria; Jennifer Ai-Wen Chan; Dae-Kyun K Ro; Carl Steven Ribble; Bijoy Kozikode Mundak Aparambil Menon; William Andrew Matthews; Ernesta Paola Neri; Donna Lynne Wood; Amanda O'Rae; Markus R Czub; Conny Davidsen; Jian (Ray) Zhang; Inesia Mary Eileen Adolph; Raymond A Patterson; Thomas J Raedler; Gilad Gour; Karen Tang; Majid Ghaderi; Noreen Mary Humble; Birgitte Grogaard; Markus Dann; Michael William Foley; Martin Koebel; Christopher Clarkson; Patricia Morgan; Charles Edwin Tepperman; Tanvir Turin Chowdhury; Diana Katherine Louise Snell; Christoph Simon; Dennis George Parsons; Savraj Singh Grewal; Lee Carruthers; Annette Tézli; Paul Barclay; Gordon Chua; Peter F. Dunfield; Amelia Kiddle; Scott Keith Radford; Chang-Chun Ling; Daniel Oblak; Frank W. Stahnisch; Mayank Goyal; Jeffrey Allan Biernaskie; Cristian Rios; Ronald Jeremy Sigal; Raymond Tellier; John S. Gilleard; Anis Syed Haque; Jason Scott Johnson; Catherine Mitchell; Jeffrey T. Joseph; Franciscus Johannes van der Meer; Jean-Sebastien Rioux. (2017),1,both,yes,yes,no
pub_575a5ec549,mem_e203a7a335,,,,,https://scholar.google.ca/citations?user=bgk559sAAAAJ&hl=en,Google Scholar,0,both,yes,yes,no
pub_26be6cbaa5,mem_e203a7a335,,,,,https://healthstandards.org/standard/pediatric-pain-management-can-hso-13200-2023-e/,World's first national health standard for pediatric pain management (SKIP and the Health Standards Organization),1,both,yes,yes,no
pub_757922fa20,mem_a3c1370499,,,,2015,,Brain Injury. S Babul; Carolyn A Emery; MacPherson A; Pike I; Kathryn J Schneider. Parachute. (2015),0,both,yes,yes,no
pub_1f155ec6d1,mem_a3c1370499,,,,2018,,Physiotherapy. Kathryn Schneider; I Gagnon; Alan Ptitto; Isabelle Gagnon. CRC Press. (2018),1,both,yes,yes,no
pub_7a9b5e39a2,mem_a3c1370499,,,,2019,,“I Kinda’ Lost My Sense of Who I Was”: Foregrounding Youths’ Experiences in Critical Conversations About Sport-Related Concussions.. Matt Ventresca; Danika Kelly; Kevin Viliunas; Kathryn Janet Schneider; William Bridel. Routledge. (2019),2,both,yes,yes,no
pub_46d8c8d635,mem_a3c1370499,,,,2014,,Vestibular disorders following concussion.. G L Iverson; K. J. Schneider; R Echemendia. University Press. (2014),3,both,yes,yes,no
pub_ea2c332759,mem_a3c1370499,,,,2011,,"Are Pre-season reports of Neck Pain, Dizziness and Headache Risk Factors for Concussion in Male Youth Ice Hockey Players?. Geoff Schneider; Kathryn J Schneider; J Kang; W Meeuwisse; Carolyn Emery. (2011)",4,both,yes,yes,no
pub_51911dbf5f,mem_a3c1370499,,,,2015,,"Baseline cervical,vestibular, dynamic balance values and tasks of divided attention and theeffect of previous concussions in elite youth ice hockey players. Kathryn Schneider; Carolyn A Emery; W H Meeuwisse. (2015)",5,both,yes,yes,no
pub_68431d03d2,mem_a3c1370499,,,,2012,,Advances in concussion management: Cervico-vestibular physiotherapy in the treatment of individuals with persistent symptoms following a sport related concussion: A randomized controlled trial.. Karen Maria Barlow; Alberto Nettel-Aguirre; Carolyn A Emery; Kathryn J Schneider; L Boyd; W H Meeuwisse. (2012),6,both,yes,yes,no
pub_c6b8186aa9,mem_a3c1370499,,,,2013,,Are Clinical Measures of Cervical Flexor Endurance and Cervical Strength Risk Factors for Concussion in Elite Youth Ice Hockey Players?. Kathryn J Schneider; W H Meeuwisse; J Kang; Carolyn A Emery. (2013),7,both,yes,yes,no
pub_dcf0b4d72e,mem_a3c1370499,,,,2013,,What Factors Increase the Risk of Concussion in Elite Youth Ice Hockey Players?. W H Meeuwisse; N Lemke; T A Blake; J Kang; Carolyn A Emery; K Taylor; Kathryn J Schneider. (2013),8,both,yes,yes,no
pub_3be3512ca6,mem_a3c1370499,,,,2009,,Examining Sport Concussion Assessment Tool Ratings for a Pee Wee Hockey Cohort.. J Kang; W H Meeuwisse; Carolyn A Emery; Kathryn Schneider. (2009),9,both,yes,yes,no
pub_44c2d916ba,mem_a3c1370499,,,,2013,,Can normative data and test-retest reliability of the Sport Concussion Assessment Tool 2 be established in Pee Wee ice hockey players?. Carolyn A Emery; M Krolikowski; Kathryn J Schneider; A K Macpherson. (2013),10,both,yes,yes,no
pub_384d304614,mem_a3c1370499,,,,2015,,Mouthguard Use in Youth Ice Hockey and the Incidence of Concussion and Dental Injuries.. D Chisolm; Brent Hagel; Carolyn Emery; N Romanow; Kathryn J Schneider. (2015),11,both,yes,yes,no
pub_4b4ef4e3dc,mem_a3c1370499,,,,2014,,Comparing self-reported concussion history between a paper-based questionnaire and ImPACT in a sample of elite youth ice hockey players.. C D McKay; Kathryn J Schneider; M Mrazik; Carolyn A Emery; Brian L Brooks. (2014),12,both,yes,yes,no
pub_58db501f22,mem_a3c1370499,,,,2014,,Vestibular dysfunction following paediatric traumatic brain injury—Prevalence and exploration of a novel diagnostic tool.. Michael Esser; T P Hong; Kathryn J Schneider; A Scurfield; Karen Maria M Barlow; M Narous. (2014),13,both,yes,yes,no
pub_ab41aad21c,mem_a3c1370499,,,,2010,,Patient safety: Where do we draw the lines in clinical practice? (An evidence-based inter-divisional knowledge translation symposium).. Carolyn Emery; Angie Andreoli; Kathleen Norman; Diana Hopkins-Rosseel.; Kathryn Schneider; Meena Sran. (2010),14,both,yes,yes,no
pub_e9322a9f0c,mem_a3c1370499,,,,2015,,Evidence-informed policy change in youth sport: Preventing concussions in youth ice hockey. BH Hagel; W H Meeuwisse; Kathryn Schneider; Carolyn A Emery; C Goulet; M Krolikowski; A Black; Alberto Nettel-Aguirre. (2015),15,both,yes,yes,no
pub_881bbc1140,mem_a3c1370499,,,,2010,,When the room is spinning what do you do? An overview of vestibular assessment for the physiotherapist.. Kathryn J Schneider. (2010),16,both,yes,yes,no
pub_8972ad368c,mem_a3c1370499,,,,2014,,"The sport concussion assessment tool in elite youth ice hockey: normative values, reliability & predictive utility.. K A Taylor; N Lemke; Carolyn A Emery; Kathryn Schneider; W Meeuwisse; J Kang; K Woollings; T A Blake. (2014)",17,both,yes,yes,no
pub_7b7b224c14,mem_a3c1370499,,,,2015,,"Is there an association between early season baseline symptoms of dizziness, neck pain and headache and clinical measures of cervical and vestibular function in 11 and 12 year old ice hockey players?. Kathryn Schneider; C* Codd; T Blake; Carolyn Emery. (2015)",18,both,yes,yes,no
pub_c8ba6414bb,mem_a3c1370499,,,,2016,,The utility of prism lenses as a diagnostic tool for concussion. Little CEEmery. (2016),19,both,yes,yes,no
pub_ed5e5af1b1,mem_a3c1370499,,,,2014,,Sport-Related Concussion: An Update on the Latest Evidence and Practical Implications. Kathryn Schneider. (2014),20,both,yes,yes,no
pub_cfaf077f1e,mem_a3c1370499,,,,2016,,Canadian Paediatric Common Data Elements. I Gagnon. (2016),21,both,yes,yes,no
pub_7cd00f19f8,mem_a3c1370499,,,,2010,,Development of a thoracic spine pain and functional ability measure.. A. Hooper; Kathryn J Schneider; Geoff Schneider; P Stratford. (2010),22,both,yes,yes,no
pub_470a7b2b1f,mem_a3c1370499,,,,2009,,Minimizing the source of nociception and its concurrent effect on sensory hypersensitivity: an exploratory study in Chronic whiplash patients.. M Westaway; L Olson; Allen Hooper; Kathryn Schneider; Geoff Schneider; A Smith; P Stratford; B Frizzell. (2009),23,both,yes,yes,no
pub_81964cf6dd,mem_a3c1370499,,,,2015,,Difference in symptoms reported by parents and children on baseline measures of the Child SCAT3. A M Black; W H Meeuwisse; Kathryn J Schneider; Carolyn A Emery. 124-128. (2015),24,both,yes,yes,no
pub_eaf6181d5b,mem_a3c1370499,,,,2012,,"Modifiers and long term issues: Are clinical measures of cervical flexor endurance, divided attention and dynamic visual acuity different in elite youth ice hockey players who report a previous history of concussion compared to those who do not?. W H Meeuwisse; Carolyn A Emery; J Kang; Kathryn J Schneider. (2012)",25,both,yes,yes,no
pub_3d322eda92,mem_a3c1370499,,,,2016,,"Changes in measures of cervical, vestibular, dynamic balance and tasks of divided attention following sport-related concussions in elite youth ice hockey players.. Schneider KJ Palacios-Derflingther. (2016)",26,both,yes,yes,no
pub_05c284cf02,mem_a3c1370499,,,,2012,,Multimodal physiotherapy in the treatment of individuals with persistent symptoms following a sport related concussion: A Randomized Controlled Trial.. Carolyn A Emery; Alberto Nettel-Aguirre; Kathryn J Schneider; L Boyd; Karen Maria M Barlow; W H Meeuwisse. (2012),27,both,yes,yes,no
pub_565e59c2bd,mem_a3c1370499,,,,2014,,Cervico-vestibular physiotherapy in the treatment of individuals with persistent symptoms following sport-related concussion: A randomized controlled trial.. L Boyd; Karen Maria Barlow; W H Meeuwisse; Kathryn J Schneider; Alberto Nettel-Aguirre; J Kang; Carolyn A Emery. (2014),28,both,yes,yes,no
pub_4aaa2eadb2,mem_a3c1370499,,,,2012,,Acute Sports Concussion: What factors increase the risk of concussion in elite youth ice hockey players?. W H Meeuwisse; J Kang; T A Blake; Carolyn A Emery; K Taylor; N Lemke; Kathryn J Schneider. (2012),29,both,yes,yes,no
pub_406defb86e,mem_a3c1370499,,,,2010,,"What is the Risk of Concussion in Pee Wee and Bantam Male Hockey Players Reporting Pre-season Symptoms of Neck Pain, Headaches, and Dizziness?. Carolyn A Emery; Geoff Schneider; J Kang; Kathryn Schneider; W H Meeuwisse. (2010)",30,both,yes,yes,no
pub_22768196fb,mem_a3c1370499,,,,2015,,Concussion rates and recovery in elite youth ice hockey players. W H Meeuwisse; T Blake; Kathryn Schneider; Carolyn A Emery. (2015),31,both,yes,yes,no
pub_8fa4b68bd1,mem_a3c1370499,,,,2012,,"Sport Concussion Assessment Tool, Version 2, Normative Values and Test-Retest Reliability in Elite Youth Ice Hockey.. J Kang; K A Taylor; W H Meeuwisse; T A Blake; Kathryn J Schneider; K Y Woollings; Carolyn A Emery. (2012)",32,both,yes,yes,no
pub_1c6a78b861,mem_a3c1370499,,,,2014,,Neurocognitive performance at return to play in elite youth hockey players with sport-related concussion.. T A Blake; Karen Maria M Barlow; Brian L Brooks; W H Meeuwisse; Carolyn A Emery; C D McKay; J Kang; Kathryn J Schneider; K Taylor. (2014),33,both,yes,yes,no
pub_4e01a4d117,mem_a3c1370499,,,,2009,,"Symptom and Functional Improvements Following a Course of Vestibular Rehabilitation, Manual Physiotherapy and Spinal Stabilization Exercises in High Performance Athletes with Complex Concussions.. Carolyn A Emery; Kathryn J Schneider; W H Meeuwisse. (2009)",34,both,yes,yes,no
pub_fe52829e47,mem_a3c1370499,,,,2014,,Persistent Whiplash Symptoms: From Bio to Psycho to Sensori-Motor Modulation of Clinical Manifestations of Whiplash Associated Disorders and Back Again: Can Physiotherapy Intervene?. Kathryn Schneider; Ashley Smith; Geoff Schneider. (2014),35,both,yes,yes,no
pub_96390430e9,mem_a3c1370499,,,,2014,,Do risk factors differ for concussion and prolonged recovery following concussion in elite youth ice hockey players?. K Taylor; T Blake; Carolyn A Emery; Kathryn Schneider; J Kang; W H Meeuwisse; N Lemke. (2014),36,both,yes,yes,no
pub_32f7248c61,mem_a3c1370499,,,,2010,,Baseline Sport Concussion Assessment Tool (SCAT) Ratings in Youth Ice Hockey Players.. Kathryn Schneider; Carolyn A Emery; J Kang; W H Meeuwisse; Geoff Schneider. (2010),37,both,yes,yes,no
pub_bec5c2df62,mem_a3c1370499,,,,2014,,Are clinical measures of cervical spine strength and cervical flexor endurance risk factors for concussion in elite youth ice hockey players.. J Kang; Kathryn J Schneider; W H Meeuwisse; Carolyn A Emery. (2014),38,both,yes,yes,no
pub_185722b693,mem_a3c1370499,,,,2011,,Prevention and Health Promotion. J Cranston; O Cheifetz; C Dumoulin; H Crowley; Carolyn A Emery; D Walton; Kathryn J Schneider. (2011),39,both,yes,yes,no
pub_13c45413cb,mem_a3c1370499,,,,2010,,Paediatric Concussion-A continuum of evidence.. Kathryn Schneider; Carolyn A Emery; L Pelland; R Werstine. (2010),40,both,yes,yes,no
pub_263b29c4a4,mem_a3c1370499,,,,2014,,The value of computerized neurocognitive testing at medical clearance following a sport-related concussion in youth ice hockey players.. Black AMBrooks. (2014),41,both,yes,yes,no
pub_328496fe3e,mem_a3c1370499,,,,2009,,"Chronic whiplash associated disorders: is a cure possible after six months? The role of physiotherapy within a multidisciplinary, primary care centre.. A D Smith; Kathryn Schneider; P Fonstad; Geoff Schneider. (2009)",42,both,yes,yes,no
pub_7f11ed2b2b,mem_a3c1370499,,,,2013,,"Are Clinical Measures of Cervical Flexor Endurance, Divided Attention, and Computerized Dynamic Visual Acuity Different in Elite Youth Ice Hockey Players Who Report a Previous History of Concussion Compared to Those Who Do Not?. W H Meeuwisse; Kathryn J Schneider; J Kang; Carolyn A Emery. (2013)",43,both,yes,yes,no
pub_150a6bea74,mem_a3c1370499,,,,2012,,Are Sport Concussion Assessment Tool 2 (SCAT2) scores different for youth ice hockey players with and without a previous history of concussion?. W Meeuwisse; Kathryn J Schneider; J Kang; Carolyn Emery; T Blake. (2012),44,both,yes,yes,no
pub_062dabed68,mem_a3c1370499,,,,2015,,"Baseline cervical, vestibular, dynamic balance values and tasks of divided attention and the effect of previous concussions in elite youth ice hockey players. Kathryn Schneider; W H Meeuwisse; Carolyn A Emery. (2015)",45,both,yes,yes,no
pub_688457a6e6,mem_a3c1370499,,,,2014,,"Are clinical measures of cervical flexor endurance, divided attention and computerized dynamic visual acuity different in elite youth ice hockey players who report a previous history of concussion compared to those who do not?. Carolyn A Emery; W H Meeuwisse; Kathryn J Schneider; J Kang. (2014)",46,both,yes,yes,no
pub_521cb8450a,mem_a3c1370499,,,,2015,,"Are clinical measures of divided attention, cervical and vestibular function risk factors for concussion in elite youth ice hockey players?. Kathryn Schneider; J Kang; W Meeuwisse; Carolyn Emery. (2015)",47,both,yes,yes,no
pub_e260972cc7,mem_90269b0602,,,,,https://scholar.google.com/citations?user=5kFjd7oAAAAJ&hl=en,Google Scholar,0,both,yes,yes,no
pub_fa357b8fef,mem_d5f9a5e6ba,,,,2018,,The fundamental cognitive model. . Keith Stephen Dobson. Guilford Press. 29- 47. (2018),0,both,yes,yes,no
pub_1093f78b22,mem_d5f9a5e6ba,,,,2017,,Ethics from a global perspective . Keith Stephen Dobson. Springer Books. 145- 167. (2017),1,both,yes,yes,no
pub_4f16d43a94,mem_d5f9a5e6ba,,,,2017,,Assessment and management of ACEs in primary care: A Canadian perspective. . Keith Stephen Dobson. Association of Faculties of Medicine of Canada (AFMC). 210- 216. (2017),2,both,yes,yes,no
pub_fa78e2c731,mem_d5f9a5e6ba,,,,2017,,Behavioral activation treatments for depression. Keith Stephen Dobson. Academic Press. 291- 318. (2017),3,both,yes,yes,no
