publication_id,member_id,title,authors,journal,year,url,raw_text,sort_order,extraction_source,strict_extracted,permissive_extracted,permissive_only
pub_1eca05442f,mem_3f1cca7ee5,,,,2011,https://pubmed.ncbi.nlm.nih.gov/21842984/,"Reformulating and testing the perfectionism model of binge eating: A short-term, four-wave longitudinal study. . Mackinnon, S.P., Sherry, S.B., Graham, A.R., Stewart, S.H., Sherry, D.L., Allen, S.L., Fitzpatrick, S., & McGrath, D.S.. Journal of Counseling Psychology. 58, 630-646. (2011)",50,both,yes,yes,no
pub_de288ebcce,mem_3f1cca7ee5,,,,2010,https://psycnet.apa.org/record/2010-19091-001,"The existential model of perfectionism and depressive symptoms: A short-term, four-wave longitudinal study. . Graham, A. R., Sherry, S. B., Stewart, S. H., Sherry, D. L., McGrath, D. S., Fossum, K. M., & Allen, S. L.. Journal of Counseling Psychology. 57, 423-438. (2010)",51,both,yes,yes,no
pub_90886cb858,mem_3f1cca7ee5,,,,2010,https://www.tandfonline.com/doi/full/10.1080/14459795.2010.499915,"Self-generated motives for gambling in two population-based samples of gamblers. . McGrath, D. S., Stewart, S. H., Klein, R.M., & Barrett, S.P.. International Gambling Studies. 10, 117-138. (2010)",52,both,yes,yes,no
pub_fe6fe40352,mem_3f1cca7ee5,,,,2009,https://pubmed.ncbi.nlm.nih.gov/19930023/,"The co-morbidity of tobacco smoking and gambling: A review of the literature. . McGrath, D. S. & Barrett, S.P.. Drug and Alcohol Review. 28, 676–681. (2009)",53,both,yes,yes,no
pub_b1df92ef2f,mem_3f1cca7ee5,,,,2014,,"Tobacco Dependence. S Hofmann; S Stewart; Judit Smits. John Wiley & Sons, Ltd.. 1299-1314. (2014)",54,both,yes,yes,no
pub_89861e4e8d,mem_3f1cca7ee5,,,,2019,,Co-Morbid Smoking and Gambling: The Influence of Nicotine and Tobacco Administration on Gambling Disorder. V. R. Preedy; E. V. Ritchie; Daniel . McGrath; D. C. Hodgins. Elsevier. 20-Oct. (2019),55,both,yes,yes,no
pub_614bf06d55,mem_bd39b96aae,,,,2019,,The Community Treatment Order (CTO)-An Altruistic Overreach in Patient Care in Psychiatry. Okoro DC. Can J Psychiatry. (2019),0,both,yes,yes,no
pub_9b5433e756,mem_bd39b96aae,,,,2015,,Post traumatic Stress Disorder: The Misappropriation of Military Suicide Causation and Medication Treatment of Posttraumatic Stress Disorder. Okoro DC. Can J Psychiatry. (2015),1,both,yes,yes,no
pub_d415a5d648,mem_bd39b96aae,,,,2007,,Cannabis-induced psychosis among Aboriginal People in the Northwest Territories. Okoro D. Can J Psychiatry. (2007),2,both,yes,yes,no
pub_f6aa638321,mem_bd39b96aae,,,,2005,,Racism and mental disorders. Okoro DC. Psychiatr Serv. (2005),3,both,yes,yes,no
pub_8e638c06b1,mem_bd39b96aae,,,,2022,,"Psychiatric Phenomenology from first principles for medical students, psychiatric residents, and practitioners. Daniel Chinedu Okoro. Tellwell. (2022)",4,both,yes,yes,no
pub_f3af3f2fe0,mem_bd39b96aae,,,,2008,,Random Musings in Psychiatry; Study AIDS for Board Examination for Residents and Practitioners. Daniel Chinedu Okoro. Iuniverse. (2008),5,both,yes,yes,no
pub_989ee0df11,mem_023bd77aa2,,,,,https://www.researchgate.net/profile/Daniel_Pang,Researchgate,0,both,yes,yes,no
pub_8891825e34,mem_2561dcafb5,,,,,https://scholar.google.com/citations?user=47KrPD0AAAAJ&hl=en,Google Scholar,0,both,yes,yes,no
pub_6efce388bd,mem_b5df8f2ae8,,,,,https://www.researchgate.net/profile/David-Hodgins-2,ResearchGate,0,both,yes,yes,no
pub_70a323927c,mem_c05467d02f,,,,,https://scholar.google.ca/citations?user=D_vNTFEAAAAJ&hl=en,Google Scholar,0,both,yes,yes,no
pub_9e0f5dc37b,mem_d670519f7b,,,,2022,https://pubmed.ncbi.nlm.nih.gov/35876612/,"Prevalence of prescription and non-prescription polypharmacy by frailty and sex among middle-aged and older Canadians . Harris DA, Guo Y, Nakhla N, Tadrous M, Hogan DB, Hennessy D, Langlois K, Garner R, Leslie S, Bronskill SE, Heckman G, Maxwell CJ. Health Reports. 3-16. (2022)",0,both,yes,yes,no
pub_aa4591b787,mem_d670519f7b,,,,2022,https://pubmed.ncbi.nlm.nih.gov/35134841/,"Incidence of neurological and psychiatric comorbidity over time: a population-based cohort study in Ontario, Canada . Maxwell CJ, Maclagan LC, Harris DA, Wang X, Guan J, Marrie RA, Hogan DB, Austin PC, Vigod SN, Swartz RH, Bronskill SE. Age Ageing. afab277. (2022)",1,both,yes,yes,no
pub_9d259976f9,mem_d670519f7b,,,,2022,https://pubmed.ncbi.nlm.nih.gov/35962356/,"Prevalence and correlates of anxiety and depression in caregivers to assisted living residents during COVID-19: a cross-sectional study . Lane NE, Hoben M, Amuah JE, Hogan DB, Baumbusch J, Gruneir A, Chamberlain SA, Griffith LE, McGrail KM, Corbett K, Maxwell CJ. BMC Geriatr. 662. (2022)",2,both,yes,yes,no
pub_ce996eb84d,mem_d670519f7b,,,,2022,https://pubmed.ncbi.nlm.nih.gov/35212167/,"Aerobic exercise training in older men and women-Cerebrovascular responses to submaximal exercise: Results from the Brain in Motion study . Lake SL, Guadagni V, Kendall KD, Chadder M, Anderson TJ, Leigh R, Rawling JM, Hogan DB, Hill MD, Poulin MJ.. Physiol Rep. e15158. (2022)",3,both,yes,yes,no
pub_de85739d27,mem_d670519f7b,,,,2022,https://pubmed.ncbi.nlm.nih.gov/35337790/,"Greater Opioid Use Among Nursing Home Residents in Ontario, Canada During the First 2 Waves of the COVID-19 Pandemic . Maxwell CJ, Campitelli MA, Cotton CA, Hogan DB, Iaboni A, Gruneir A, Evans C, Bronskill SE. J Am Med Dir Assoc. 936-41. (2022)",4,both,yes,yes,no
pub_0fe3ee3ab1,mem_d670519f7b,,,,2022,https://pubmed.ncbi.nlm.nih.gov/35976489/,"Correlates of Opioid Use Among Ontario Long-Term Care Residents and Variation by Pain Frequency and Intensity: A Cross-sectional Analysis . Iacono A, Campitelli MA, Bronskill SE, Hogan DB, Iaboni A, Maclagan LC, Gomes T, Tadrous M, Evans C, Gruneir A, Guan Q, Hadjistavropoulos T, Cotton C, Gill SS, Seitz DP, Ho J, Maxwell CJ. Drugs Aging. 1-17. (2022)",5,both,yes,yes,no
pub_3900e0fa5f,mem_d670519f7b,,,,2013,https://pubmed.ncbi.nlm.nih.gov/34431471/,"How Do Non-Catastrophic Natural Disasters Impact Middle-Aged-to-Older Persons? Using Baseline Canadian Longitudinal Study on Aging Data to Explore Psychological Outcomes Associated with the 2013 Calgary Flood . Norberg SJ, Toohey AM, Hogan DB. Can J Aging. 184-92. (2022)",6,both,yes,yes,no
pub_0271296b99,mem_d670519f7b,,,,2022,https://pubmed.ncbi.nlm.nih.gov/35592692/,"A pragmatic dementia risk score for patients with mild cognitive impairment in a memory clinic population: Development and validation of a dementia risk score using routinely collected data . Wang M, Sajobi TT, Ismail Z, Seitz D, Chekouo T, Forkert ND, Fischer K, Mackie A, Pearson D, Patry D, Cieslak A, Menon B, Barber P, McLane B, Granger R, Hogan DB, Smith EE. Alzheimers Dement (N Y). e12301. (2022)",7,both,yes,yes,no
pub_983f4c1aab,mem_d670519f7b,,,,2022,https://pubmed.ncbi.nlm.nih.gov/35818014/,"Predictors of reported alcohol intake during the first and second waves of the COVID-19 pandemic in Canada among middle-aged and older adults: results from the Canadian Longitudinal Study on Aging (CLSA) . McMillan JM, Hogan DB, Zimmer C, Sohel N, Wolfson C, Kirkland S, Griffith LE, Basta NE, Raina P. Can J Public Health. 1-13. (2022)",8,both,yes,yes,no
pub_e94483e82f,mem_d670519f7b,,,,2021,https://pubmed.ncbi.nlm.nih.gov/34910151/,"Evaluation of Clinical Practice Guidelines on Fall Prevention and Management for Older Adults: A Systematic Review . Montero-Odasso MM, Kamkar N, Pieruccini-Faria F, Osman A, Sarquis-Adamson Y, Close J, Hogan DB, Hunter SW, Kenny RA, Lipsitz LA, Lord SR, Madden KM, Petrovic M, Ryg J, Speechley M, Sultana M, Tan MP, van der Velde N, Verghese J, Masud T. JAMA Netw Open. e2138911. (2021)",9,both,yes,yes,no
pub_9ee9991b1d,mem_d670519f7b,,,,2021,https://pubmed.ncbi.nlm.nih.gov/34038522/,"New horizons in falls prevention and management for older adults: a global initiative . Montero-Odasso M, van der Velde N, Alexander NB, Becker C, Blain H, Camicioli R, Close J, Duan L, Duque G, Ganz DA, Gómez F, Hausdorff JM, Hogan DB, Jauregui JR, Kenny RA, Lipsitz LA, Logan PA, Lord SR, Mallet L, Marsh DR, Martin FC, Milisen K, Nieuwboer A, Petrovic M, Ryg J, Sejdic E, Sherrington C, Skelton DA, Speechley M, Tan MP, Todd C, van der Cammen T, Verghese J, Kamkar N, Sarquis-Adamson Y, Masud T. Age Ageing. 1499-1507. (2021)",10,both,yes,yes,no
pub_d440da845d,mem_d670519f7b,,,,2021,https://pubmed.ncbi.nlm.nih.gov/33629361/,Bertrand Russell and Aging . Hogan DB. J Am Geriatric Soc. 1410-11. (2021),11,both,yes,yes,no
pub_32e6c51b61,mem_d670519f7b,,,,2021,https://pubmed.ncbi.nlm.nih.gov/34912493/,"Fear of Falling in Older Adults: A Scoping Review of Recent Literature . MacKay S, Ebert P, Harbidge C, Hogan DB. Can Geriatric J. 379-94. (2021)",12,both,yes,yes,no
pub_9cc8594fab,mem_d670519f7b,,,,2021,https://pubmed.ncbi.nlm.nih.gov/34912492/,"Consensus Statement Regarding the Application of Biogen to Health Canada for Approval of Aducanumab . Chertkow H, Rockwood K, Hogan DB, Phillips N, Montero-Odasso M, Amanullah S, Black S, Bocti C, Borrie M, Feldman H, Freedman M, Hsiung R, Kirk A, Masellis M, Nygaard H, Rajji T, Verret L. Can Geriatric J. 373-78. (2021)",13,both,yes,yes,no
pub_bf07aa8ef9,mem_d670519f7b,,,,2021,,"Construct and Criterion-Related Validity of the Clinical Frailty Scale in Persons With HIV. McMillan JM, Gill MJ, Power C, Fujiwara E, Hogan DB, Rubin LH. J Acquir Immune Def Synd . 110-16. (2021)",14,both,yes,yes,no
pub_47e581e24e,mem_d670519f7b,,,,2021,https://pubmed.ncbi.nlm.nih.gov/32281182/,"Association of sleep spindle characteristics with executive functioning in healthy sedentary middle-aged and older adults . Guadagni V, Byles H, Tyndall AV, Parboosingh J, Longman RS, Hogan DB, Hanly PJ, Younes M, Poulin MJ. J Sleep Res. e13037. (2021)",15,both,yes,yes,no
pub_9c7796fda7,mem_d670519f7b,,,,2021,https://pubmed.ncbi.nlm.nih.gov/34338794/,"Comparison of Medication Prescribing Before and After the COVID-19 Pandemic Among Nursing Home Residents in Ontario, Canada . Campitelli MA, Bronskill SE, Maclagan LC, Harris DA, Cotton CA, Tadrous M, Gruneir A, Hogan DB, Maxwell CJ. JAMA Netw Open. e2118441. (2021)",16,both,yes,yes,no
pub_71f593cfb9,mem_d670519f7b,,,,2021,https://pubmed.ncbi.nlm.nih.gov/34484503/,"Updated Inventory and Projected Requirements for Specialist Physicians in Geriatrics . Basu M, Cooper T, Kay K, Hogan DB, Morais JA, Molnar F, Lam RE, Borrie MJ. Can Geriatric J. 200-208. (2021)",17,both,yes,yes,no
pub_bcf787680b,mem_d670519f7b,,,,2021,https://pubmed.ncbi.nlm.nih.gov/33901232/,"Sex differences in multimorbidity and polypharmacy trends: A repeated cross-sectional study of older adults in Ontario, Canada . Maxwell CJ, Mondor L, Pefoyo Koné AJ, Hogan DB, Wodchis WP. PLoS One. e0250567. (2021)",18,both,yes,yes,no
pub_277fe87969,mem_d670519f7b,,,,2021,https://pubmed.ncbi.nlm.nih.gov/32452089/,"Evaluation of a balance and mobility program for older adults at risk of falling: a mixed methods study . Osho OA, Harbidge C, Hogan DB, Manns PJ, Jones CA. J Eval Clin Pract. 307-15. (2021)",19,both,yes,yes,no
pub_dc26c36306,mem_d670519f7b,,,,2021,https://pubmed.ncbi.nlm.nih.gov/33880747/,"Trends in Anticoagulant Use at Nursing Home Admission and Variation by Frailty and Chronic Kidney Disease Among Older Adults with Atrial Fibrillation . Campitelli MA, Bronskill SE, Huang A, Maclagan LC, Atzema CL, Hogan DB, Lapane KL, Harris DA, Maxwell CJ. Drugs Aging. 611-23. (2021)",20,both,yes,yes,no
pub_a0ada066cc,mem_d670519f7b,,,,2021,https://pubmed.ncbi.nlm.nih.gov/33599444/,"Examining the municipal-level representativeness of the Canadian Longitudinal Study on Aging (CLSA) cohort: an analysis using Calgary participant baseline data . Norberg SJ, Toohey AM, Jones S, McDonough R, Hogan DB. Health Promot Chronic Dis Prev Can. 48-56. (2021)",21,both,yes,yes,no
pub_d949e94f86,mem_d670519f7b,,,,2021,https://pubmed.ncbi.nlm.nih.gov/34127029/,"The Brain in Motion II Study: study protocol for a randomized controlled trial of an aerobic exercise intervention for older adults at increased risk of dementia . Krüger RL, Clark CM, Dyck AM, Anderson TJ, Clement F, Hanly PJ, Hanson HM, Hill MD, Hogan DB, Holroyd-Leduc J, Longman RS, McDonough M, Pike GB, Rawling JM, Sajobi T, Poulin MJ. Trials. 394. (2021)",22,both,yes,yes,no
pub_c569e9e7ee,mem_d670519f7b,,,,2021,https://pubmed.ncbi.nlm.nih.gov/34732476/,"Protocol for a systematic review and meta-analysis assessing the effectiveness of deprescribing in falls prevention in older people . Seppala LJ, Kamkar N, Ryg J, Masud T, Daams J, Montero-Odasso MM, Hartikainen S, Petrovic M, van der Velde N; Task Force on Global Guidelines for Falls in Older Adults (includes DB Hogan). BMJ Open. e047190. (2021)",23,both,yes,yes,no
pub_4f6cd2729d,mem_d670519f7b,,,,2021,https://press.ucalgary.ca/books/9781773851648/,"Creating the Future of Health . Robert Lampard, David B. Hogan, Frank W. Stanisch, and James R. Wright, Jr.. University of Calgary Press. 420. (2021)",24,both,yes,yes,no
pub_667d72fc7e,mem_c98befafc2,,,,,,"Development and initial evaluation of a skateboarding program for youth and caregivers based on trauma-informed therapeutic recreation principles. Lindenbach, D., Collins, C.M., Pippus, J., Okoye, H.U., Tansey, I., Black, A.M., Dimitropoulos, G., & Wang, E.Y.. Submitted.",0,both,yes,yes,no
pub_18b1f56332,mem_c98befafc2,,,,,,"A nonrandomized pre-post mixed-methods evaluation of the Brief UP intervention in post-secondary students: psychological outcomes, feasibility, and acceptability. Borkenhagen, D., Dimitropoulos, G., Lindenbach, D., Habina, C., Thannhauser, J., Rowbotham, M., Hews-Girard, J., Bekai, N., Mair, E., Patten, S., Ehrenreich-May, J., & Arnold, P. Submitted.",1,both,yes,yes,no
pub_cd2c2fd390,mem_c98befafc2,,,,,,"A randomized effectiveness trial of the Unified Protocol for Transdiagnostic Treatment of Emotional Disorders for Adolescents in a therapeutic school setting. Okoye, H.U., Lindenbach, D., Manderson, D., Wang, E.Y., Hews-Girard, J., Ehrenreich-May, J., Arnold, P., & Dimitropoulos, G. Submitted.",2,both,yes,yes,no
pub_c9db528294,mem_c98befafc2,,,,2026,https://onlinelibrary.wiley.com/doi/10.1002/eat.24558,"Adverse childhood experiences predict treatment drop out in adolescents and young adults with eating disorders . Lindenbach, D., Austin, A., Singh, M., Trebilcock, A., Bhattarai, A., Marcoux-Louie, G., & Dimitropoulos, G. International Journal of Eating Disorders. 205-210. (2026)",3,both,yes,yes,no
pub_23446e4eab,mem_c98befafc2,,,,2025,https://www.sciencedirect.com/science/article/pii/S0145213425005010,"A scoping review of literature on the Neurosequential Model and interventions guided by the Neurosequential Model . Lindenbach, D., Desai, P., Berza, V., Lee, J., Okoye, H., Herman, P., Dimitropoulos, G., Arnold, P.D., & Wang, E.Y. Child Abuse & Neglect. 107745. (2025)",4,both,yes,yes,no
pub_8f199ba7d8,mem_c98befafc2,,,,2025,https://www.sciencedirect.com/science/article/pii/S2950193825000592,"Child and caregiver perspectives on implementing a transdiagnostic cognitive behavioral therapy for children impacted by trauma in a residential treatment setting . Lindenbach, D. Wang, E.Y., Scammell, J., O’Neill, T., Bennett, S., Mohammadi, F., Ehrenreich-May, J., Arnold, P.D., & Dimitropoulos, G.. Child Protection and Practice. (2025)",5,both,yes,yes,no
pub_7538a14cdf,mem_c98befafc2,,,,2025,https://onlinelibrary.wiley.com/doi/10.1002/eat.24368,"Ecological momentary assessment for adolescents with Anorexia Nervosa and their parents/caregivers in family-based treatment . Singh, M., Austin, M., Lindenbach, D., Vander Steen, H., Habina, C., Marcoux-Louie, G., Loeb, K., Engel, S., LeGrange, D. & Dimitropoulos, G.. International Journal of Eating Disorders. (2025)",6,both,yes,yes,no
pub_6d0a686bac,mem_c98befafc2,,,,2025,https://www.traumaconsortium.com/en/analysis-practice-policy/,"A trauma-informed analysis of child & youth policies in Alberta . 1. Savard, L., Collin-Vézina, D., Saint Girons, M., Hémond-Dussault, V., Boussand-Nadler, L., Lindenbach, D., Parker, N. & Passi, J.. Canadian Consortium on Child and Youth Trauma. (2025)",7,both,yes,yes,no
pub_5ee2b20802,mem_c98befafc2,,,,2024,https://www.tandfonline.com/doi/full/10.1080/0145935X.2024.2429656,"The impact of reflective practice on the wellbeing and competency of supervisors and frontline staff in a non-profit community provider of mental health services for youth and families . Lindenbach, D., Dimitropoulos, G., Wood, V., Bainbridge, C., Anderson, A., Hervey, V., Arnold, P.D. & Wang, E.Y.. Child & Youth Services. 1-23. (2024)",8,both,yes,yes,no
pub_ae239a93b8,mem_c98befafc2,,,,2024,https://www.tandfonline.com/doi/full/10.1080/0145935X.2024.2340550,"Feasibility and acceptability of implementing a transdiagnostic cognitive behavioral therapy for children impacted by trauma within a residential treatment facility . Lindenbach, D., Anderson, A., Wang, E., Heintz, M., Rowbotham, M., Ehrenreich-May, J., Arnold, P.D. & Dimitropoulos, G . Child & Youth Services. 1-26. (2024)",9,both,yes,yes,no
pub_c74add25b5,mem_c98befafc2,,,,2024,https://link.springer.com/article/10.1007/s42448-024-00207-x,"Confidence, training and barriers for Canadian law enforcement in cases of luring, sexual abuse and child sex abuse imagery . Fitts, A., Binford, W., Lindenbach, D. & Dimitropoulos, G. . International Journal of Child Maltreatment. (2024)",10,both,yes,yes,no
pub_e0dca2e6c2,mem_c98befafc2,,,,2024,https://www.researchprotocols.org/2024/1/e51667,"Using a rapid learning health System for stratified care in emerging adult mental health services: Protocol for the implementation of patient-reported outcome measures . Dimitropoulos, G., Lindenbach, D., Potestio, M., Mogan, T., Richardson, A., Anderson, A., Heintz, M., Moskovic, K., Gondziola, J., Bradley, J., La Monica, H., Iorfino, F., Hickie, I.B., Patten, S.B. & Arnold, P.D. JMIR Research Protocols. 13. (2024)",11,both,yes,yes,no
pub_118449656f,mem_c98befafc2,,,,2023,https://www.ncbi.nlm.nih.gov/pmc/articles/PMC10168613/,"Feasibility and acceptability of a brief, online transdiagnostic psychotherapy for young adults . Dimitropoulos, G., Lindenbach, D., Rowbotham, M., Devoe, D.J., Richardson, A., Mogan, T., Patten, S.B., Ehrenreich-May, J. & Arnold, P.D. Journal of the Canadian Academy of Child & Adolescent Psychiatry. 32(2): 111-125. (2023)",12,both,yes,yes,no
pub_5e8e1da97b,mem_c98befafc2,,,,2023,https://www.sciencedirect.com/science/article/pii/S0145213423004751,"A qualitative study on the implementation of a transdiagnostic cognitive behavioral therapy for children in a child welfare residential treatment program . Dimitropoulos, G., Lindenbach, D., Anderson, A., Rowbotham, M., Wang, E., Heintz, M., Ehrenreich-May, J. & Arnold, P.D. Child Abuse & Neglect. 146, 106487. (2023)",13,both,yes,yes,no
pub_ce5b6b1284,mem_c98befafc2,,,,2023,https://link.springer.com/chapter/10.1007/978-3-031-33739-0_10,"A trauma-informed approach to the Unified Protocol for Children with exposure to child maltreatment . Gruen, R., Lindenbach, D., Ehrenreich-May, J., Arnold, P. & Dimitropoulos, G. In Shenk, C. (Ed.). Innovative Methods in Child Maltreatment Research and Practice. 199-225. (2023)",14,both,yes,yes,no
pub_3287eba161,mem_c98befafc2,,,,2023,https://obrieniph.ucalgary.ca/sites/default/files/teams/1/Recommendations-for-a-Comprehensive-Youth-Mental-Health-Strategy-in-Alberta.pdf,"Recommendations for a comprehensive youth mental health strategy for Alberta . Arnold, P.D., Dimitropoulos, G., Lindenbach, D., Zwicker, J., & Greer, K. Alberta 2023: Health System Challenges and Opportunities. (2023)",15,both,yes,yes,no
pub_aff7a601f0,mem_c98befafc2,,,,2022,https://www.sciencedirect.com/science/article/abs/pii/S0166432822002960,"Optogenetic modulation of glutamatergic afferents from the ventral subiculum to the nucleus accumbens: Effects on dopamine function, response vigor and locomotor activity . Lindenbach, D., Vacca, G., Ahn, S., Seamans, J.K. & Phillips, A.G. Behavioural Brain Research . 434, 114028. (2022)",16,both,yes,yes,no
pub_bd4ea17dc1,mem_c98befafc2,,,,2022,https://www.sciencedirect.com/science/article/abs/pii/S0145213421005172,"Experiences of Canadian mental health providers in identifying and responding to online and in-person sexual abuse and exploitation of their child and adolescent clients . Dimitropoulos, G.*, Lindenbach, D.*, Devoe, D.J., Gunn, E., Cullen, O., Bhattarai, A., Kuntz, J., Binford, W. & Arnold, P.D. Child Abuse & Neglect. 124, 105448. *co-first authors. (2022)",17,both,yes,yes,no
pub_85ed41ba9f,mem_c98befafc2,,,,2022,https://www.tandfonline.com/doi/full/10.1080/10538712.2022.2037803,"Confidence, training and challenges for Canadian child advocacy center staff when working with cases of online and in-person child sexual exploitation . Lindenbach, D., Dimitropoulos, G., Bhattarai, A., Cullen, O., Perry, R, Arnold, P.D. & Patten, S.B. Journal of Child Sexual Abuse. 31, 297-315. (2022)",18,both,yes,yes,no
pub_2300886eba,mem_c98befafc2,,,,,https://scholar.google.com/citations?user=_fPa1W4AAAAJ&hl=en,Google Scholar,19,both,yes,yes,no
pub_b8786be49f,mem_c98befafc2,,,,,https://www.researchgate.net/profile/David-Lindenbach,Research Gate,20,both,yes,yes,no
pub_d2f6bd9ace,mem_3e0e98847e,,,,2015,,Autism spectrum disorder and the family: Examining impacts and the need for support.. E. Anagnostou; C. Kilmer; D. B. Nicholas; J. Brian. ADIS/Springer. 77-86. (2015),0,both,yes,yes,no
pub_4bb15dbbab,mem_3e0e98847e,,,,2012,,The experiences of fathers of a child with a chronic health condition: Caregiving experiences and potential support interventions. L. Wenger; K. Daly; T. McNeill; J. Ball; J. Beaton; D. B. Nicholas. UBC Press. Chapter 9. (2012),1,both,yes,yes,no
pub_2a482c23c3,mem_3e0e98847e,,,,2008,,Our system of health care. T. McNeill; D. B. Nicholas; J. C. Turner; F. J. Turner. Allyn & Bacon Canada. 258-269. (2008),2,both,yes,yes,no
pub_5500d407a6,mem_3e0e98847e,,,,2014,,Paediatric patient-centred care at SickKids: : Advancing child and family-centred care.. D. B. Nicholas; K. Keilty; Randi Zlotnik Shaul; K. Karmali; K. Sappleton. Springer. 129-143. (2014),3,both,yes,yes,no
pub_e325bf7b6f,mem_3e0e98847e,,,,2002,,"Participant perceptions of online groupwork with fathers of children with spina bifida. N. Sullivan; L. Mitchell; D. Goodman; E. S. Mesbur; D. Nicholas; N. C. Lang. Binghamton, NY. 227-240. (2002)",4,both,yes,yes,no
pub_bef97452bc,mem_3e0e98847e,,,,2014,,Paediatric patient-centred care: Evidence and evolution.. Karmali; Randi Zlotnik Shaul; K.; Keilty; D. B. Nicholas. Springer. Chapter 2. (2014),5,both,yes,yes,no
pub_d998d9cf6f,mem_3e0e98847e,,,,2007,,"Perceptions of online support for hospitalized children and adolescents. K. O'Leary; L. Brister; S. Dumont; D. Berlin; J. Darch; T. McNeill; D. Koller; M. St. Onge. The Haworth Press, Inc. 205-225. (2007)",6,both,yes,yes,no
pub_cb241a95a7,mem_3e0e98847e,,,,1998,,"Struggles, strengths and strategies: The lived experience of healthy siblings of children with End Stage Renal Disease. A. Richardson; D. B. Nicholas. Kanata Learning Company Ltd. 236-248. (1998)",7,both,yes,yes,no
pub_ba4c3f7c9e,mem_3e0e98847e,,,,2010,,The potential of technology for providing social support to people and families. V. Coates; D. B. Nicholas; B. Paterson; D. Kralik. Blackwell Science Publishers. 143-161. (2010),8,both,yes,yes,no
pub_46b833225e,mem_3e0e98847e,,,,2016,,Bullying in children and youth with autism spectrum disorders.. L. Zwaigenbaum; J. Eliason; J. Cummings; D. B. Nicholas; W. Craig; D. Pepler. National Printers. 68-79. (2016),9,both,yes,yes,no
pub_094b3d79ca,mem_3e0e98847e,,,,2007,,"An evaluation of dyadic peer support caregiving parents of children with chronic lung disease requiring technology assistance. M. St. Onge; K.; S. Dumont; Keilty; D. B. Nicholas. The Haworth Press, Inc. 245-260. (2007)",10,both,yes,yes,no
pub_65e877cd35,mem_3e0e98847e,,,,2012,,Integrating clinical practice and classroom learning through heightened hospital/university partnership. D. Flomo; D. Nicholas. IASSW Sweden. 1-1. (2012),11,both,yes,yes,no
pub_dd22ba44ed,mem_3e0e98847e,,,,2011,,Processes of meaningful community/university research partnerships in fostering change: The case study of qualitative study addressing the care needs of persons with mental illness and developmental disability. M. Milen; G. Elliot; D. B. Nicholas; R. Scott; L. Kreitzer; W. Hawkins; G. Zuk; K. Cole; E. Khalema; R. Bodor; J. Shankar; A. M. McLaughlin; A. Calhoun; S. Tanchak. International Institute for Qualitative Research. 22. (2011),12,both,yes,yes,no
pub_354ec30a82,mem_3e0e98847e,,,,2012,,Integrating qualitative research on the experience of fathers of children with neurodevelopmental disorders.. L. Lach; D. Nicholas; T. McNeill; M. Saini; A. Bogossian. International Institute for Qualitative Research. 29. (2012),13,both,yes,yes,no
pub_e956feeb36,mem_3e0e98847e,,,,2009,,The Emerging Notion of Hope and the Complex Journey for Parents of Children with Cancer. N. D’Agostino; M. Barrera; D. B. Nicholas; J. Shaheed. World Congress on Psycho-Oncology. S205. (2009),14,both,yes,yes,no
pub_51e58ce476,mem_3e0e98847e,,,,2011,,A participatory approach to online education and support curriculum development for families of children with a heart transplant. I. Larsen; G. Alton; J. Ellis; S. Anthony; D. B. Nicholas; R. Duff; S. Urschel; K. Simard; N. Devlin; L. Altamirano; T. Olthuizen; L. West; B. Dodd. International Institute for Qualitative Research. 10. (2011),15,both,yes,yes,no
pub_6bae241b0f,mem_3e0e98847e,,,,2013,,Transportation Research and Policy Review for ASD Individuals Across Canada: A Lifespan Perspective. International Society for Autism Research. 240. (2013),16,both,yes,yes,no
