publication_id,member_id,title,authors,journal,year,url,raw_text,sort_order,extraction_source,strict_extracted,permissive_extracted,permissive_only
pub_be7d4e7daa,mem_0f24dba938,,,,2018,,Characterization of post-surgical memories in parents and adolescents after surgery. J Joo; J Rabbitts; M Noel; T Palermo; E Fisher; R Aaron. (2018),77,both,yes,yes,no
pub_728e0b4e6a,mem_0f24dba938,,,,2018,,Usability testing of a web-based resource to improve infant pain practices: The Implementation of Pain Practice Change(ImPaC) resource. A Willan; N Gill; A Synnes; W Isaranuwatchai; J Yamada; M Bueno; M Noel; S Riahi; B Stevens; C T Chambers; S Gibbins; S- A Li; M Barwick; D Harrison; J Slotta; M Campbell-Yeo; J Stinson; S LeMay; C Estabrooks. A46-A67. (2018),78,both,yes,yes,no
pub_532d32b622,mem_0f24dba938,,,,2018,,The moderating role of cancer survivorship status on the strength of the relationship between trauma symptoms and health-related quality of life in pediatric ALL survivors. M Noel; B *Russell; L Tomfohr-Madsen; F Schulte. (2018),79,both,yes,yes,no
pub_a715415af8,mem_0f24dba938,,,,2018,,Decreasing recurrent pain and anxiety in medical procedures with a pediatric population: A pilot study protocol. S LeMay; J S Fortin; D Labbe; A Ballard; D Paquin; M Hupin; I Perreault; S Bouchard; C Khadra; M Noel; H G Hoffman; J Dery. (2018),80,both,yes,yes,no
pub_b7764cf209,mem_0f24dba938,,,,2018,,Improvement in outcomes following intensive pain rehabilitation for youth with chronic pain. *A McPeak; L Rayner; M Noel; *J Vinall; N Rasic; A Connors. (2018),81,both,yes,yes,no
pub_092ae79d43,mem_0f24dba938,,,,2018,,Predictors of negatively biased memory for pain one year after pediatric major surgery: A longitudinal study of anxiety and related constructs in pain memory development. F Campbell; B Rosenbloom; M *Pavlova; MG Pagé; J Katz; M Noel; J Stinson; L Isaac. (2018),82,both,yes,yes,no
pub_91d304d7ca,mem_0f24dba938,,,,2018,,Emotional modulation of pain: Mechanisms of risk and resilience across the life span. T V Salomons; F Zeidan; M Noel; J Katz. (2018),83,both,yes,yes,no
pub_a41c680600,mem_0f24dba938,,,,2018,,The role of parent-child reminiscing about pain on children’s post-surgical pain memories: A longitudinal examination. N Rasic; *J Vinall; S A Graham; J Chorney; A Jordan; M Noel; *M Pavlova. (2018),84,both,yes,yes,no
pub_cc0ab73fa1,mem_0f24dba938,,,,2018,,Preliminary testing of program theory plausibility: An example in specialized paediatric pain rehabilitation programs using logic analysis. A Brousselle; C Camden; M Noel; K *Hurtubise. (2018),85,both,yes,yes,no
pub_ade2e309ef,mem_0f24dba938,,,,2018,,The chronic pain network’s (CPN) clinical research network (CRN). T Rice; K Kilborn; L Patterson; M White; S Duggan; S Rashiq; S Lau; Y Shir; A Finley; M Lynch; E Bissonf; M Noel; M Verrier; P Poulin; L Ferguson; A McPeak; A MacInnes; J Dhillon; E-L Khoo; R Zacharias; I Gilron; R El-Gabalawy; J Stinson; C DeBow; L Harris; N Buckley; K Baerg; A Brown; N Rasic; F Campbell; K Jarvi; C Schneider; C McMahon; M Choiniere; J Banfield. A71-A184. (2018),86,both,yes,yes,no
pub_876eafb1f5,mem_0f24dba938,,,,2018,,Grappling with uncertainty: A quantitative examination of diagnostic uncertainty in youth with chronic pain and their parents. M Noel; T *Lund; *J K Beveridge. (2018),87,both,yes,yes,no
pub_18cbacaf5c,mem_0f24dba938,,,,2018,,Predicting child and adolescent functioning one year after major orthopedic surgery. M Noel; J Stinson; F Campbell; J Katz; B N Rosenbloom; L Isaac; M G Pagé. (2018),88,both,yes,yes,no
pub_0acf8a2771,mem_0f24dba938,,,,2018,,The Implementation of Pain Practice Change (ImPaC) Resource: A prototype usability testing in non-clinical and clinical settings. D Harrison; M Barwick; J Stinson; S LeMay; J Yamada; S Riahi; S- A Li; J Slotta; A Willan; S Gibbins; M Campbell-Yeo; M Bueno; A Synnes; B Stevens; C Estabrooks; C Chambers; M Noel; W Isaranuwatchai. (2018),89,both,yes,yes,no
pub_9e6c28bff7,mem_0f24dba938,,,,2018,,"Cognitive biases in pain: Current challenges, future directions and treatment opportunities. D ML Van Ryckeghem; G JG Asmundson; M Noel. A4-A45. (2018)",90,both,yes,yes,no
pub_c68f9b772b,mem_0f24dba938,,,,2018,,Headache long after pediatric concussion: Association with subjective and objective cognitive functioning. M Noel; V *Kwan; K Yeates; B L Brooks; V Plourde. (2018),91,both,yes,yes,no
pub_e63b792c2f,mem_0f24dba938,,,,2018,,Sleep and posttraumatic stress symptoms differentially associated with pain and quality of life in youth with chronic pain. M Noel; *J K Beveridge; N Rasic; *A McPeak; J *Vinall. (2018),92,both,yes,yes,no
pub_1097584d6b,mem_0f24dba938,,,,2018,,Parental chronic pain status related to higher posttraumatic stress symptoms and lower quality of life in youth with chronic pain. M Noel; A Wilson; J K *Beveridge; A Stone. (2018),93,both,yes,yes,no
pub_57eba24482,mem_0f24dba938,,,,2018,,Abnormal hippocampal and amygdalar volume in children with chronic pain. M Noel; L J Ayoub; C Lebel; S Lee; M Moayedi; *J Vinall. (2018),94,both,yes,yes,no
pub_6b9136c296,mem_0f24dba938,,,,2017,,Emotional availability while reminiscing about post-surgical pain contributes to child pain memory development. *L McCallum; J *Vinall; M Noel; *M Pavlova; N Rasic. (2017),95,both,yes,yes,no
pub_4dc6037813,mem_0f24dba938,,,,2018,,The influence of parent-child reminiscing about post-surgical pain on children’s pain memory development: A longitudinal examination. *J Vinall; M *Pavlova; *L McCallum; M Noel. (2018),96,both,yes,yes,no
pub_3a9bd9b51a,mem_0f24dba938,,,,2017,,The role of parent anxiety in young children’s pain memory development following surgery. L *McCallum; *M Pavlova; *J Vinall; M Noel. Canadian Pain Society. (2017),97,both,yes,yes,no
pub_3752562542,mem_0f24dba938,,,,2017,,Changes in GABA and improvements in quality of life following intensive pain rehabilitation. A Harris; M Noel; J *Vinall; N Rasic; V Riddell; K Carter; D Lythgoe; G Barker. (2017),98,both,yes,yes,no
pub_50dccef467,mem_0f24dba938,,,,2017,,The role of parent mental health in pediatric chronic pain. M Latimer; J Stinson; P Arnold; C Sears; J Katz; M Noel; J Chorney; N Rasic; *J Vinall; A Finley; A Harris; S Bray; T Vervoort; T Palermo; L Cooper. (2017),99,both,yes,yes,no
pub_60cc1b62de,mem_0f24dba938,,,,2017,,Finding silver linings: A preliminary examination of benefit finding in pediatric chronic pain. S *Soltani; M Noel. (2017),100,both,yes,yes,no
pub_9a7a098fc7,mem_0f24dba938,,,,2017,,School functioning in children with chronic pain: A review and preliminary model. *KM Jones; M Noel. Canadian Pain Society. 1-1. (2017),101,both,yes,yes,no
pub_99e49ce79f,mem_0f24dba938,,,,2017,,Unravelling the relationship between parental PTSD and pediatric chronic pain: The mediating role of pain catastrophizing. M Noel; *A Neville. Canadian Pain Society. 1-1. (2017),102,both,yes,yes,no
pub_96429e36cf,mem_0f24dba938,,,,2017,,"Identifying outcome domains to evaluate pediatric chronic pain rehabilitation program: What is meaningful to youth, parents and other stakeholders?. *L McCallum; *K Hurtubise; A Brousselle; C Camden; M Noel. Canadian Pain Society. 1-1. (2017)",103,both,yes,yes,no
pub_a92c64edf0,mem_0f24dba938,,,,2017,,"Selecting outcome domains to evaluate the effectiveness of a multidisciplinary pediatric pain rehabilitation program: What is meaningful to youth, parents and other stakeholders?. K *Hurtubise; C Camden; *L McCallum; M Noel; A Brousselle. (2017)",104,both,yes,yes,no
pub_d06e87f5e6,mem_0f24dba938,,,,2017,,Parental emotional availability while reminiscing about post-surgical pain contributes to children's pain memory development. M Noel; *M Pavlova; *L McCallum; J *Vinall; N Rasic. Canadian Pain Society. (2017),105,both,yes,yes,no
pub_ca1382d952,mem_0f24dba938,,,,2019,,Pain and fear of cancer recurrence in long-term survivors of childhood cancer. *A Neville; *B Russell; M *Patton; M Noel; *M Khu; F Schulte. (2019),106,both,yes,yes,no
pub_df37bf0b38,mem_0f24dba938,,,,2019,,"A Multimethod, Longitudinal Mediation Analysis of Sleep, Anxiety, and Pediatric Chronic Pain. T *Wihak; R Mychasiuk; M Noel; *A McPeak. (2019)",107,both,yes,yes,no
pub_61f1ca9e0c,mem_0f24dba938,,,,2019,,Decreasing REcurrent Pain and Anxiety in Medical Procedures with a Paediatric Population (DREAM): A Pilot Study. D Paquin; S Bouchard; S LeMay; C Khadra; M Hupin; A Ballard; M Noel; J S Fortin; J Déry; I Perreault. (2019),108,both,yes,yes,no
pub_0968a886e3,mem_0f24dba938,,,,2019,,The temporal relationship between insomnia and pain interference in pregnancy . L Tomfohr-Madsen; A *Dhillon; A L McKinnin; I Sedov; M Noel. (2019),109,both,yes,yes,no
pub_6c10c71865,mem_0f24dba938,,,,2019,,Child and parent predictors of healthcare utilization amongst children and adolescents with chronic pain. M Noel; N Rasic; K A Birnie. (2019),110,both,yes,yes,no
pub_b2dff4f692,mem_0f24dba938,,,,2019,,Remembering past pain and expecting future pain: A preliminary analysis on the role of child attention to pain parental (non-)pain attentive behaviour. M Noel; D Van Ryckeghem; A *Wauters; T Vervoort. (2019),111,both,yes,yes,no
pub_dda1f9f242,mem_0f24dba938,,,,2019,,PTSD Symptoms as a Mediator in the Relationship Between Pre-Sleep Arousal and Chronic Pain in Youth. R Mychasiuk; M Noel; C *Nania; T Wihak. (2019),112,both,yes,yes,no
pub_58dfc9bf08,mem_0f24dba938,,,,2019,,Changes in parent protective responses influence changes in child functioning and pain acceptance over the course of intensive pain rehabilitation. N Rasic; L Rayner; *A McPeak; *J Vinall; M Noel. (2019),113,both,yes,yes,no
pub_e542b18d89,mem_0f24dba938,,,,2019,,Quantifying changes in excitation and inhibition in childhood migraine. M Webb; A Harris; F Amoozegar; T Bell; M Noel. (2019),114,both,yes,yes,no
pub_85505cc453,mem_0f24dba938,,,,2019,,Effectiveness of MEDi® for the management of children’s pain and fear during IV induction: Help from a humanoid robot. R Lee; J Pearson; T N Beran; L Bell-Graham; M Noel; A Spencer. (2019),115,both,yes,yes,no
pub_9d9c62a806,mem_0f24dba938,,,,2019,,When “A Headache is Not Just a Headache”: A Qualitative Examination of Parent and Child Experiences of Pain After Childhood Cancer. Poster abstract submitted for the 51st Annual Congress of the International Society of Paediatric Oncology. P R *Tutelman; F Schulte; J N Stinson; C T Chambers; J MacLeod; C V Fernandez; A Flanders; G MT Guilcher; L C Heathcote; M Stern; M Noel; R Urquhart. (2019),116,both,yes,yes,no
pub_09aae2d007,mem_0f24dba938,,,,2019,,The Implementation of Pain Practice Change (ImPaC) Resource: Usability Evaluation of a Knowledge Translation Intervention for Neonatal Pain. J Yamada; C Estabrooks; A Willan; M Barwick; A Lanese; A Synnes; S Riahi; W Isaranuwatchai; S LeMay; S Gibbins; M Campbell-Yeo; Melanie Noel; M Bueno; J Stinson; B Stevens; D Harrison; C Chambers; S- A Li. (2019),117,both,yes,yes,no
pub_2e8e0f5ed0,mem_0f24dba938,,,,2019,,Reframe the pain: Dividing attention and altering memory to reduce needle pain and distress in children. F Braithwaite; M Noel; T Stanton. (2019),118,both,yes,yes,no
pub_69cfe49c96,mem_0f24dba938,,,,2019,,Attentional biases in pediatric chronic pain: preliminary evidence from a longitudinal eye tracking study on pain and mental health in youth. M Noel; S *Soltani. (2019),119,both,yes,yes,no
pub_127bc1bca5,mem_0f24dba938,,,,2019,,Depression Mediates the Relationship Between Insomnia and Pediatric Chronic Pain Over Time. M Noel; *A McPeak; T *Wihak. (2019),120,both,yes,yes,no
pub_f8f7f7eb0e,mem_28292f693f,,,,,https://scholar.google.ca/citations?user=fzcE4ScAAAAJ&hl=en,Google Scholar,0,both,yes,yes,no
pub_164115e3c7,mem_67b2999f43,,,,,https://scholar.google.ca/citations?hl=en&pli=1&user=tn5li5UAAAAJ,Google Scholar,0,both,yes,yes,no
pub_3623de9c60,mem_9d290c25df,,,,,https://pubmed.ncbi.nlm.nih.gov/?term=Esser+MJ&sort=date,National Library of Medicine,0,both,yes,yes,no
pub_066381139c,mem_ecc4765dd3,,,,,https://www.researchgate.net/profile/Mohammed-Shakeel,Researchgate,0,both,yes,yes,no
pub_c60f0e3ab8,mem_6f76ca3c25,,,,2025,,"Medical Professionalism: Theory, Education, and Practice. Oxford University Press. (2025)",0,both,yes,yes,no
pub_e06a33dede,mem_6f76ca3c25,,,,2024,,"Opioid Agonist Treatment: A presciber’s guide to treatment.. Alyssa Kelly, Ghosh, Monty. (2024)",1,both,yes,yes,no
pub_b976892eec,mem_6f76ca3c25,,,,,https://scholar.google.ca/citations?user=5JMSpy0AAAAJ&hl=en,Google Scholar,2,both,yes,yes,no
pub_41d6609c10,mem_902f442140,,,,,https://pubmed.ncbi.nlm.nih.gov/?term=morris+scantlebury&sort=date,National Library of Medicine,0,both,yes,yes,no
pub_7b09d53643,mem_cce204cb8c,,,,2020,https://www.amazon.ca/Parenting-Child-Development-Issues-Answers-ebook/dp/B08DG8MG1Z/ref=sr_1_3?qid=1636405308&refinements=p_27%3ADr.+Nicole+Letourneau&s=books&sr=1-3,"Parenting and Child Development: Issues and Answers . Woodside: London, UK. (2020)",0,both,yes,yes,no
pub_1ed56c0524,mem_cce204cb8c,,,,2018,https://www.amazon.ca/What-Kind-Parent-Am-Self-Surveys/dp/1459739000/ref=sr_1_1?qid=1636405308&refinements=p_27%3ADr.+Nicole+Letourneau&s=books&sr=1-1,"What Kind of Parent Am I? Self-Surveys that Reveal the Impact of Toxic Stress and More . Dundurn: Toronto, ON. (2018)",1,both,yes,yes,no
pub_47f10befbd,mem_cce204cb8c,,,,2013,https://www.amazon.ca/Scientific-Parenting-Science-Parental-Influence/dp/1459710088/ref=sr_1_2?qid=1636405570&refinements=p_27%3ADr.+Nicole+Letourneau&s=books&sr=1-2,Scientific Parenting: What Science Reveals About Parental Influence . Dundurn: Toronto: ON. (2013),2,both,yes,yes,no
pub_1274387ab8,mem_cce204cb8c,,,,,https://scholar.google.com/citations?hl=en&user=0JelkzYAAAAJ&view_op=list_works&sortby=title,Google Scholar,3,both,yes,yes,no
pub_5547b569ee,mem_c695f19acd,,,,,https://www.ncbi.nlm.nih.gov/pubmed/?term=forkert+n,National Library of Medicine,0,both,yes,yes,no
pub_f16f0b57c7,mem_c695f19acd,,,,,https://scholar.google.ca/citations?user=ld1C8zUAAAAJ&hl=en,Google Scholar,1,both,yes,yes,no
pub_7599d74f56,mem_a27c0b453b,,,,,https://www.ncbi.nlm.nih.gov/myncbi/ning.cheng.2/bibliography/public/%C2%A0,National Library of Medicine,0,both,yes,yes,no
pub_7c1681f713,mem_d3afbe9061,,,,,https://scholar.google.com/citations?user=VwkAoigAAAAJ&hl=en,Google Scholar,0,both,yes,yes,no
pub_757b6eed32,mem_3a936b52e4,,,,,https://scholar.google.ca/citations?user=-59o30AAAAAJ&hl=en,Google Scholar,0,both,yes,yes,no
pub_f90160d02a,mem_0f847603bd,,,,,https://scholar.google.com/citations?user=0p4Ozx4AAAAJ&hl=en&authuser=1,Google Scholar Publications,0,both,yes,yes,no
pub_b9ede8e9bf,mem_98015aef5e,,,,1997,https://rupress.org/jem/article/186/7/1059/7315/A-Mechanism-for-the-Major-Histocompatibility,"A mechanism for the Major Histocompatibility Complex-linked resistance to autoimmunity . Schmidt D, Verdaguer J, Averill N, Santamaria P.. Journal of Experimental Medicine. 186 (7): 1059-1075. (1997)",0,both,yes,yes,no
pub_c03fe829ea,mem_98015aef5e,,,,1997,https://rupress.org/jem/article/186/10/1663/7189/Spontaneous-Autoimmune-Diabetes-in-Monoclonal-T,"Spontaneous autoimmune diabetes in monoclonal T-cell NOD Mice . Verdaguer J, Schmidt D, Amrani A, Anderson B, Averill N, Santamaria P.. Journal of Experimental Medicine. 186 (10): 1663-1676. (1997)",1,both,yes,yes,no
pub_fc9c3eb0c7,mem_98015aef5e,,,,1999,https://www.pnas.org/doi/abs/10.1073/pnas.96.16.9311,"Prevalent CD8+ T cell response against one peptide/MHC complex in autoimmune diabetes . Anderson B, Park B-J, Amrani A, Verdaguer J, Bou S, Santamaria P.. PNAS. 96 (16): 9311-9316. (1999)",2,both,yes,yes,no
pub_aca5499efe,mem_98015aef5e,,,,2000,https://www.nature.com/articles/35021081,"Progression of autoimmune diabetes driven by avidity maturation of a T-cell population . Amrani A, Verdaguer J, Serra P, Tafuro S, Tan R, Santamaria P.. Nature. 406: 739–742. (2000)",3,both,yes,yes,no
pub_fed2410a42,mem_98015aef5e,,,,2002,https://www.sciencedirect.com/science/article/pii/S1074761302003151,"CD154-dependent priming of diabetogenic CD4+ T-cells dissociated from activation of Antigen-Presenting Cells . Amrani A, Serra P, Yamanouchi J, Han B, Thiessen S, Verdaguer J, Santamaria P.. Immunity. 16 (5): 719-732. (2002)",4,both,yes,yes,no
pub_185729bda4,mem_98015aef5e,,,,2003,https://www.sciencedirect.com/science/article/pii/S1074761303003273,"CD40 ligation releases immature dendritic cells from the control of regulatory CD4+ CD25+ T-cells . Serra P, Amrani A, Yamanouchi J, Han B, Thiessen S, Utsugi T, Verdaguer P, Santamaria, P.. Immunity. 19 (6): 877-889. (2003)",5,both,yes,yes,no
pub_2704e23985,mem_98015aef5e,,,,2005,https://www.nature.com/articles/nm1250,"Prevention of diabetes by manipulation of anti-IGRP autoimmunity: high efficiency of a low-affinity peptide . Han B, Serra P, Amrani A, Yamanouchi J, Marée AF, Edelstein-Keshet L, Santamaria P.. Nature Medicine. 11: 645–652. (2005)",6,both,yes,yes,no
pub_72f9d99218,mem_98015aef5e,,,,2005,https://www.jci.org/articles/view/24219,"Developmental control of CD8+ T-cell avidity maturation in autoimmune diabetes . Han B, Serra P, Yamanouchi J, Amrani A, Elliott JF, Dickie P, Dilorenzo TP, Santamaria P.. Journal of Clinical Investigation. 115 (7): 1879–1887. (2005)",7,both,yes,yes,no
pub_25f68e961f,mem_98015aef5e,,,,2007,https://www.nature.com/articles/ng1958,"Interleukin-2 gene variation impairs regulatory T cell function and causes autoimmunity . Yamanouchi J, Rainbow D, Serra P, Howlett S, Hunter K, Garner VE, Gonzalez-Munoz A, Clark J, Veijola R, Cubbon R, Chen SL, Rosa R, Cumiskey AM, Serreze DV, Gregory S, Rogers J, Lyons PA, Healy B, Smink LJ, Todd JA, Peterson LB, Wicker LS, Santamaria P.. Nature Genetics. 39: 329–337. (2007)",8,both,yes,yes,no
pub_b07470b850,mem_98015aef5e,,,,2010,https://www.sciencedirect.com/science/article/pii/S1074761310001226,"Reversal of autoimmunity by boosting memory-like autoregulatory T-cells . Tsai S, Shameli A, Yamanouchi J, Clemente-Casares X, Wang J, Serra P, Yang Y, Medarova Z, Moore A, Santamaria P.. Immunity. 32 (4): 568-580. (2010)",9,both,yes,yes,no
pub_ab68be2f26,mem_98015aef5e,,,,2010,https://www.pnas.org/doi/abs/10.1073/pnas.0913835107,"In situ recognition of autoantigen as an essential gatekeeper in autoimmune CD8+ T cell inflammation . Wang J, Tsai S, Shameli A, Yamanouchi J, Alkemade G, Santamaria P. . PNAS. 107 (20): 9317-9322. (2010)",10,both,yes,yes,no
pub_c75f44dd35,mem_98015aef5e,,,,2013,https://www.pnas.org/doi/abs/10.1073/pnas.1211391110,"Antidiabetogenic MHC class II promotes the differentiation of MHC-promiscuous autoreactive T cells into FOXP3+ regulatory T cells . Tsai S, Serra-Devecchi P, Clemente-Casares X, Yamanouchi J, Thiessen S, Slattery RM, Elliott JF, Santamaria P.. PNAS. 110 (9): 3471-3476. (2013)",11,both,yes,yes,no
pub_3b1b9e75a8,mem_98015aef5e,,,,2016,https://www.nature.com/articles/nature16962,"Expanding antigen-specific regulatory networks to treat autoimmunity . Clemente-Casares X, Blanco J, Ambalavanan P, Yamanouchi J, Singha S, Fandos C, Tsai S, Wang J, Garabatos N, Izquierdo C, Agrawal S, Keough MB, Yong VW, James E, Moore A, Yang Y, Stratmann T, Serra P, Santamaria P.. Nature. 530: 434–440. (2016)",12,both,yes,yes,no
pub_090c36c299,mem_98015aef5e,,,,2017,https://www.nature.com/articles/nnano.2017.56,"Peptide-MHC-based nanomedicines for autoimmunity function as T-cell receptor microclustering devices . Singha, S, Shao K, Yang Y, Clemente-Casares, X, Clemente A, Blanco J, Dai Q, Liu SW, Yamanouchi J, Umeshappa C, Nanjundappa R, Detampel P, Amrein M, Fandos C, Tanguay R, Newbigging S, Serra P, Khadra A, Chan WCW, Santamaria P.. Nature Nanotechnology. 12: 701–710. (2017)",13,both,yes,yes,no
pub_da6e129edb,mem_98015aef5e,,,,2017,https://www.sciencedirect.com/science/article/pii/S0092867417311169?via%3Dihub,"A gut microbial mimic that hijacks diabetogenic autoreactivity to suppress colitis . Nanjundappa, R, Ronchi, F, Wang, J, Clemente-Casares, X, Yamanouchi, J, Umeshappa, K, Yang, Y, Blanco, J, Bassolas-Molina, H, Salas, A, Khan, H, Slattery, RM, Wyss, M, Mooser, K, Macpherson, AJ, Sycuro, LK, Serra, P, McKay, DM, McCoy, KD, Santamaria, P.. Cell. 171 (3): 655-667. (2017)",14,both,yes,yes,no
pub_813877aeb0,mem_98015aef5e,,,,2019,https://www.nature.com/articles/s41587-019-0015-4,"Antigen-specific therapeutic approaches for autoimmunity . Serra, P., Santamaria, P.. Nature Biotechnology. 37: 238–251. (2019)",15,both,yes,yes,no
pub_7099c29ed1,mem_98015aef5e,,,,2019,https://www.nature.com/articles/s41467-019-09893-5,"Suppression of a broad spectrum of liver autoimmune pathologies by single peptide-MHC-based nanomedicines . Sokke Umeshappa C, Singha S, Blanco J, Lee J, Shao K, Nanjundappa R, Yamanouchi J, Parés A, Serra P, Yang Y, Santamaria P.. Nature Communications. 10: 2150. (2019)",16,both,yes,yes,no
pub_9226a94671,mem_98015aef5e,,,,2019,https://www.nature.com/articles/s41467-019-12902-2,"Increased yields and biological potency of knob-into-hole-based soluble MHC class II molecules . Serra P, Garabatos, N, Singha, S, Fandos, C, Garnica, J, Sole P, Parras D, Yamanouchi J, Blanco J, Tort M, Ortega M, Yang Y, Ellestad KE, Santamaria P.. Nature Communications. 10: 4917. (2019)",17,both,yes,yes,no
pub_6dcdbedab0,mem_98015aef5e,,,,2020,https://www.jci.org/articles/view/130670,"Ubiquitous antigen-specific T-regulatory type 1 cells variably suppress hepatic and extra-hepatic autoimmunity . Sokke Umeshappa K, Singha S, Yamanouchi J, Hebbandi Nanjundappa R, Shao K, Christen U, Yang Y, Ellestad KE, Santamaria P.. Journal of Clinical Investigation. 130 (4):1823–1829. (2020)",18,both,yes,yes,no
pub_bb23ccf00c,mem_98015aef5e,,,,2021,https://www.sciencedirect.com/science/article/pii/S2211124721002333,"Liver-specific T-regulatory type-1 cells program local neutrophils to suppress hepatic autoimmunity via CRAMP . Sokke Umeshappa, K., Solé, P., Surewaard, B.G.J, Mohapatra, S., Yamanouchi, J., Ortega, M., Singha, S., Mondal, D., Yang, Y., Vignali, D.A.A., Serra, P., Kubes, P. and Santamaria, P.. Cell Reports. 34 (13): 108919. (2021)",19,both,yes,yes,no
pub_d81bca8c8f,mem_3d16baf56d,,,,,https://scholar.google.com/citations?user=eJBbTkYAAAAJ&hl=en,Google Scholar,0,both,yes,yes,no
pub_143d40cd64,mem_90ed7fe13a,,,,,https://scholar.google.ca/citations?hl=en&user=t1KUy6oAAAAJ&view_op=list_works&gmla=AJsN-F6B8mwk9blMsRKT-EGphh7_p90x7xVZojQPxYftUYIrMR3ovvAOcNqeoWR5b6hgf6dHwbnoW_komYz76IXvrMhqy_2JHMt6HCV7HYxsentjbnnXiY8,Google Scholar,0,both,yes,yes,no
pub_42f375fa8f,mem_750ab2b996,,,,,https://scholar.google.com/citations?hl=en&user=o1BYTL4AAAAJ,Google Scholar,0,both,yes,yes,no
pub_115444080c,mem_e4ccd8bf83,,,,,https://pubmed.ncbi.nlm.nih.gov/?term=Pittman+Q&sort=date,National Library of Medicine,0,both,yes,yes,no
pub_dd63f75217,mem_79f23a1fd5,,,,,https://scholar.google.com/scholar?hl=en&as_sdt=0%2C5&q=ranita+manocha&btnG=,Google Scholar,0,both,yes,yes,no
pub_4a9d3d4137,mem_cf878ce2e9,,,,,https://scholar.google.ca/citations?hl=en&user=Zt0QlJoAAAAJ,Google Scholar,0,both,yes,yes,no
pub_1c94259f9b,mem_3a1d20823e,,,,2021,,"Pandey, R. , Chan, D., Hoare,T., Li, Y-F., Soleymani, L. (2021) Integrating programmable DNAzymes with electrical readout for rapid and culture-free bacterial detection using a handheld platform. Nature Chemistry. IF- 21.6. Featured in Daily News UK, and Eureka Alert (AAAS).",0,both,yes,yes,no
pub_bb365d4230,mem_3a1d20823e,,,,2021,,"Pandey,R.,* Zhang,Z.,* Li, J.,* et.al. , (2021) High affinity dimeric aptamers enable rapid electrochemical detection of wild-type and b.1.1.7 sars-cov-2 in unprocessed saliva. Angewandte Chemie (In press). IF- 12.9 *co-first authors",1,both,yes,yes,no
pub_9c4261643c,mem_3a1d20823e,,,,2021,,"Jangid. K., Sahu. R.P., Pandey. R., Chen. R., Zhitomirsky.I.,Puri. I.K. (2021) Multiwalled carbon nanotubes coated with nitrogen–sulfur co-doped activated carbon for detecting fenitrothion. ACS Appl. Nano Mater. 4 (5), 4781–4789.",2,both,yes,yes,no
pub_1aef552e82,mem_3a1d20823e,,,,2021,,"Saha. S., Allelein. S., Pandey. R. , Medina-Perez. P., Kuhlmeier, D., Soleymani. L. (2021) Reverse concentration-to-signal electrochemical assay: a method for analyzing cancer-related microRNA embedded in extracellular vesicles. ACS Sensors (In press). IF- 7.1.",3,both,yes,yes,no
pub_45f5fd84b5,mem_3a1d20823e,,,,2021,,"Pandey.R.,* Lu,Y.,* Osman.E., Zhang,Z.,Smieja,M., Li, Y-F., Soleymani, L., Hoare,T. (2021). Rapid, culture free and wash free electrochemical quantification of the bacteria using magnetic microgel beads. Angewandte Chemie (Submitted), IF- 10.7 *co-first authors",4,both,yes,yes,no
pub_52029d20ae,mem_3a1d20823e,,,,2020,,"Victorious, A., Saha, S., Pandey, R , Soleymani, L. (2020). Enhancing the sensitivity of photoelectrochemical DNA biosensing using plasmonic DNA barcodes and differential signal readout. Angewandte Chemie. 60 (13), 7316-7322. IF- 12.9",5,both,yes,yes,no
pub_e53654e640,mem_3a1d20823e,,,,2020,,"Traynor, S. M., Wang, G. A., Pandey, R. , Li, F., & Soleymani, L. (2020). Dynamic bio‐barcode assay enables electrochemical detection of a cancer biomarker in undiluted human plasma: a sample‐in‐answer‐out approach. Angewandte Chemie . 59(50), 22617-22622. IF- 12.9, Featured in Advanced Science News and Diagnostic World News.",6,both,yes,yes,no
pub_ba43bdf251,mem_3a1d20823e,,,,2020,,"Saha, S., Victorious, A., Pandey, R. , Clifford, A., Zhitomirsky, I., & Soleymani, L. (2020). Differential photoelectrochemical biosensing using dna nanospacers to modulate electron transfer between metal and semiconductor nanoparticles. ACS Applied Materials & Interfaces , 12(33), 36895-36905. IF- 8.7",7,both,yes,yes,no
